post_id,subreddit,title,text,score,upvote_ratio,num_comments,created_utc,created_date,author,url,permalink,content_type,combined_text,polarity,subjectivity,sentiment_category,comment_id,parent_id,is_submitter
1bqd4eq,,,"> full story 2015: PH Internet pioneer [Jim Ayson dies at 53]( 2019: Benjie Tan, Pinoy engineer who connected PH to Internet, [dies at 60]( My 1st experience online was on a T1 line (1.544Mbps) of a provincial ISP 25 months later. I wanted to make a company website for our family business back then but sadly that only occurred a decade later.",167,,,1711676917.0,2024-03-29 09:48:37,patientbare,,,comment,"> full story 2015: PH Internet pioneer [Jim Ayson dies at 53]( 2019: Benjie Tan, Pinoy engineer who connected PH to Internet, [dies at 60]( My 1st experience online was on a T1 line (1.544Mbps) of a provincial ISP 25 months later. I wanted to make a company website for our family business back then but sadly that only occurred a decade later.",-0.025,0.425,neutral,kx1srhr,t3_1bqd4eq,False
1bqd4eq,,,Thank you Benjie Tan. May you rest in peace.,79,,,1711677945.0,2024-03-29 10:05:45,,,,comment,Thank you Benjie Tan. May you rest in peace.,0.0,0.0,neutral,kx1vcfx,t3_1bqd4eq,False
1bqd4eq,,,"Sometimes, I wish I was there just to experience what it was like realtime. Must've been one huge milestone to witness.",104,,,1711679161.0,2024-03-29 10:26:01,drippinginblue,,,comment,"Sometimes, I wish I was there just to experience what it was like realtime. Must've been one huge milestone to witness.",0.3999999999999999,0.9,positive,kx1ye88,t3_1bqd4eq,False
1bqd4eq,,,Wow. My first online foray was around 1996-97 at the internet cafes in makati. Didn't realize we only got connected a few years before that,42,,,1711678421.0,2024-03-29 10:13:41,comradeyeltsin0,,,comment,Wow. My first online foray was around 1996-97 at the internet cafes in makati. Didn't realize we only got connected a few years before that,0.0374999999999999,0.6083333333333333,neutral,kx1wjfl,t3_1bqd4eq,False
1bqd4eq,,,Tumataginting na 64kpbs. Tuwang tuwa na ko nun sa US Robotics 33.6 sportster modem ko,32,,,1711679212.0,2024-03-29 10:26:52,keepitsimple_tricks,,,comment,Tumataginting na 64kpbs. Tuwang tuwa na ko nun sa US Robotics 33.6 sportster modem ko,0.0,0.0,neutral,kx1yiuv,t3_1bqd4eq,False
1bqd4eq,,,I remember first time makatry ng internet nung nasa up diliman pa ako nagaaral mga 1995. Sa math library yata yon. Tapos ginamit namin pang download ng guitar tabs. Tapos lahat nagpadownload na.,31,,,1711681762.0,2024-03-29 11:09:22,Anakngtao,,,comment,I remember first time makatry ng internet nung nasa up diliman pa ako nagaaral mga 1995. Sa math library yata yon. Tapos ginamit namin pang download ng guitar tabs. Tapos lahat nagpadownload na.,0.25,0.3333333333333333,positive,kx24mql,t3_1bqd4eq,False
1bqd4eq,,,*hears dial up sound*,31,,,1711684830.0,2024-03-29 12:00:30,Momshie_mo,,,comment,*hears dial up sound*,0.4,0.4,positive,kx2bck9,t3_1bqd4eq,False
1bqd4eq,,,"For some reason I really miss the anachronisms used to refer to the Internet. Like ""information superhighway"" or ""surf the world wide web."" Naging out of fashion bigla.",31,,,1711687030.0,2024-03-29 12:37:10,harry_ballsanya,,,comment,"For some reason I really miss the anachronisms used to refer to the Internet. Like ""information superhighway"" or ""surf the world wide web."" Naging out of fashion bigla.",0.05,0.3,neutral,kx2foj0,t3_1bqd4eq,False
1bqd4eq,,,"Ah, I remember my elder sister being the tech-savvy one. I asked for her help way back in '97 to find tips & tricks for FFVII in Yahoo since I was having trouble defeating Emerald Weapon :))",24,,,1711685078.0,2024-03-29 12:04:38,ryuteepo,,,comment,"Ah, I remember my elder sister being the tech-savvy one. I asked for her help way back in '97 to find tips & tricks for FFVII in Yahoo since I was having trouble defeating Emerald Weapon :))",0.0999999999999999,0.3999999999999999,neutral,kx2buqw,t3_1bqd4eq,False
1bqd4eq,,,"D ko naabutan to , kaya cant relate sa mga comments ahaha. Ilang taon na ba kayo?",17,,,1711690775.0,2024-03-29 13:39:35,Asterus_Rahuyo,,,comment,"D ko naabutan to , kaya cant relate sa mga comments ahaha. Ilang taon na ba kayo?",0.0,0.0,neutral,kx2m0ut,t3_1bqd4eq,False
1bqd4eq,,,"Rest in Peace to the man who pioneered the inspiring work that finally brings internet to the Philippines which is the greatest contributor to the development of the Information Technology in the Philippines. Three decades later, his efforts made our country into top-ranking in terms of social media usage and video vlog consumption that made special: it made the Philippines as the social media and vlogging capital of the world despite underlying problems that we are still facing when dealing with unresolved cases of disinformation and online propaganda as well as other downsides.",16,,,1711691912.0,2024-03-29 13:58:32,ARBRangerBeans,,,comment,"Rest in Peace to the man who pioneered the inspiring work that finally brings internet to the Philippines which is the greatest contributor to the development of the Information Technology in the Philippines. Three decades later, his efforts made our country into top-ranking in terms of social media usage and video vlog consumption that made special: it made the Philippines as the social media and vlogging capital of the world despite underlying problems that we are still facing when dealing with unresolved cases of disinformation and online propaganda as well as other downsides.",0.1887566137566138,0.4644179894179895,positive,kx2nqry,t3_1bqd4eq,False
1bqd4eq,,,I first got online in '96 dun sa work namin. The very first picture I saved was a black and white pic of Ralph Fiennes ahaha Kaway-kaway sa mga naka-Netscape dyan.,15,,,1711684275.0,2024-03-29 11:51:15,VindiciVindici,,,comment,I first got online in '96 dun sa work namin. The very first picture I saved was a black and white pic of Ralph Fiennes ahaha Kaway-kaway sa mga naka-Netscape dyan.,0.1020833333333333,0.3,positive,kx2a69v,t3_1bqd4eq,False
1bqd4eq,,,I wish these types of historical moments in PH tech history were taught more in schools. This is a type of story that I'll only probably hear from my IT college professor I went through computer classes in secondary school and took up an IT related degree but never came across the names of people who made internet access for our country possible,13,,,1711703579.0,2024-03-29 17:12:59,shadow-watchers,,,comment,I wish these types of historical moments in PH tech history were taught more in schools. This is a type of story that I'll only probably hear from my IT college professor I went through computer classes in secondary school and took up an IT related degree but never came across the names of people who made internet access for our country possible,0.0333333333333333,0.5333333333333333,neutral,kx338os,t3_1bqd4eq,False
1bqd4eq,,,Naalala ko tuloy ang Blast Card! 100 peso tapos pag may tumawag sayo sa telepono mawawalan ka internet.,8,,,1711684068.0,2024-03-29 11:47:48,matcha_tapioca,,,comment,Naalala ko tuloy ang Blast Card! 100 peso tapos pag may tumawag sayo sa telepono mawawalan ka internet.,0.0,0.0,neutral,kx29qpc,t3_1bqd4eq,False
1bqd4eq,,,I remember that day. It was the time when we still use BBS and me trying to get email and connection to internet via Fido net. I got my 16kbps modem from HMR.,7,,,1711680895.0,2024-03-29 10:54:55,Tongresman2002,,,comment,I remember that day. It was the time when we still use BBS and me trying to get email and connection to internet via Fido net. I got my 16kbps modem from HMR.,0.0,0.0,neutral,kx22mca,t3_1bqd4eq,False
1bqd4eq,,,kanino sya nag-email?,8,,,1711678562.0,2024-03-29 10:16:02,augustcero,,,comment,kanino sya nag-email?,0.0,0.0,neutral,kx1ww60,t3_1bqd4eq,False
1bqd4eq,,,"I can't post the link here, but DICT's FB page featured Benjie Tan in a 5-minute video.",8,,,1711697027.0,2024-03-29 15:23:47,zandydave,,,comment,"I can't post the link here, but DICT's FB page featured Benjie Tan in a 5-minute video.",0.0,0.0,neutral,kx2uuls,t3_1bqd4eq,False
1bqd4eq,,,"This gave me goosebumps. Sobrang amazed ako noon, I think it was in 1996 when UST set up a bunch of computers sa library connected to the worldwide web. I would spend my allocated time browsing the Amazon store catalogue, usually albums ng favorite bands ko.",6,,,1711694967.0,2024-03-29 14:49:27,glassyleif,,,comment,"This gave me goosebumps. Sobrang amazed ako noon, I think it was in 1996 when UST set up a bunch of computers sa library connected to the worldwide web. I would spend my allocated time browsing the Amazon store catalogue, usually albums ng favorite bands ko.",0.125,0.625,positive,kx2s2ea,t3_1bqd4eq,False
1bqd4eq,,,I had the pleasure of working with Benjie in Globe. RIP dude i didn't know that I was working with a legend,5,,,1711690245.0,2024-03-29 13:30:45,AffectionatePeak9085,,,comment,I had the pleasure of working with Benjie in Globe. RIP dude i didn't know that I was working with a legend,0.0,0.0,neutral,kx2l7go,t3_1bqd4eq,False
1bqd4eq,,,So was this email also the first email from Ph thru the internet or did PH at that time have an intranet infrastructure already?,3,,,1711700572.0,2024-03-29 16:22:52,Important_Talk_5388,,,comment,So was this email also the first email from Ph thru the internet or did PH at that time have an intranet infrastructure already?,0.25,0.3333333333333333,positive,kx2zed3,t3_1bqd4eq,False
1bqd4eq,,,"Hayes Accura 33.6 modem using irf.ph.net 1996 downloading of files still being done via BBS - Eddie Salonga's Livewire, Rose Hitosis' PNP, Wonderworks, etc Hit upvote kung naaalala nyo pa yang mga yan haha",4,,,1711681533.0,2024-03-29 11:05:33,Academic-Recipe-9548,,,comment,"Hayes Accura 33.6 modem using irf.ph.net 1996 downloading of files still being done via BBS - Eddie Salonga's Livewire, Rose Hitosis' PNP, Wonderworks, etc Hit upvote kung naaalala nyo pa yang mga yan haha",0.4,0.625,positive,kx243s7,t3_1bqd4eq,False
1bqd4eq,,,That's so cool.,3,,,1711683100.0,2024-03-29 11:31:40,My_Immortal_Flesh,,,comment,That's so cool.,0.35,0.65,positive,kx27nkr,t3_1bqd4eq,False
1bqd4eq,,,"1998 back then, my first internet connection back then is a dial-up internet connection, hindi ko maalala kung anong ISP yun (im pretty sure its not Bl nor Internet Bonanza) at 32k baud rate!",3,,,1711695400.0,2024-03-29 14:56:40,cdf_sir,,,comment,"1998 back then, my first internet connection back then is a dial-up internet connection, hindi ko maalala kung anong ISP yun (im pretty sure its not Bl nor Internet Bonanza) at 32k baud rate!",0.225,0.4444444444444445,positive,kx2snsj,t3_1bqd4eq,False
1bqd4eq,,,wow i'm surprised to see my university here,3,,,1711701549.0,2024-03-29 16:39:09,findingnana,,,comment,wow i'm surprised to see my university here,0.1,0.95,neutral,kx30n2c,t3_1bqd4eq,False
1bqd4eq,,,"My father once worked with him, knowing him and another engineer personally. He had me sit down with him, show me a picture of him and Tan together, and told me stories about the guy. Good person. Instrumental to our country getting access to the Internet. :)",5,,,1711709416.0,2024-03-29 18:50:16,Forever_Observer2020,,,comment,"My father once worked with him, knowing him and another engineer personally. He had me sit down with him, show me a picture of him and Tan together, and told me stories about the guy. Good person. Instrumental to our country getting access to the Internet. :)",0.261111111111111,0.5472222222222223,positive,kx3bgly,t3_1bqd4eq,False
1bqd4eq,,,"Sana may gumawa ng movie about sa milestone na yan. Magstasa struggle ng buhay before internet (syempre dapat comedic!), Then next scenes yung pagpaplano, right thru execution. Comedic suspense dapat yung buong time na dinedeliver nya sa kotse yung machine. Then syempre scenes of celebrations na. End credits anticlimactic papakita yung screenshot ng ""Philippines has one of the slowest internet speed in the world""",4,,,1711714402.0,2024-03-29 20:13:22,Dear_Procedure3480,,,comment,"Sana may gumawa ng movie about sa milestone na yan. Magstasa struggle ng buhay before internet (syempre dapat comedic!), Then next scenes yung pagpaplano, right thru execution. Comedic suspense dapat yung buong time na dinedeliver nya sa kotse yung machine. Then syempre scenes of celebrations na. End credits anticlimactic papakita yung screenshot ng ""Philippines has one of the slowest internet speed in the world""",0.1428571428571428,0.2678571428571428,positive,kx3k7lr,t3_1bqd4eq,False
1bqd4eq,,,Sa bahay alumni nag lagay sila ng terminal nung launch. Nung wala na tao dahil kumain na pinuntahan ko. Una ko kinalikot ang netscape navigator. Open din ang mirc chat na tab. Chat agad hahaha,3,,,1711689020.0,2024-03-29 13:10:20,Moinder,,,comment,Sa bahay alumni nag lagay sila ng terminal nung launch. Nung wala na tao dahil kumain na pinuntahan ko. Una ko kinalikot ang netscape navigator. Open din ang mirc chat na tab. Chat agad hahaha,0.1,0.45,neutral,kx2j7ub,t3_1bqd4eq,False
1bqd4eq,,,"cool! I didn't experience internet until 2002, and my yahoo acct still exist! Mas matanda na siya sa ibang redditor hahaha",3,,,1711746404.0,2024-03-30 05:06:44,Accomplished-Exit-58,,,comment,"cool! I didn't experience internet until 2002, and my yahoo acct still exist! Mas matanda na siya sa ibang redditor hahaha",0.3734375,0.525,positive,kx5w2zp,t3_1bqd4eq,False
1bqd4eq,,,salamat sa inyong dalawa for bought the internet in our country.,2,,,1711691896.0,2024-03-29 13:58:16,franzcopinaPH,,,comment,salamat sa inyong dalawa for bought the internet in our country.,0.0,0.0,neutral,kx2npx1,t3_1bqd4eq,False
1bqd4eq,,,1994 in the timestamp. 👌,1,,,1711686472.0,2024-03-29 12:27:52,,,,comment,1994 in the timestamp. 👌,0.0,0.0,neutral,kx2em5b,t3_1bqd4eq,False
1bqd4eq,,,ph internet origins? :O h,1,,,1711686939.0,2024-03-29 12:35:39,bastiisalive,,,comment,ph internet origins? :O h,0.05,1.0,neutral,kx2fia4,t3_1bqd4eq,False
1bqd4eq,,,got exposed to the internet first sa hard rock cafe in Hong Kong. They had free use of a computer and internet. Pre teen pa lang ako noon so i just added .com to cartoonetwork and nickelodeon. haha.,1,,,1711692214.0,2024-03-29 14:03:34,darthvader93,,,comment,got exposed to the internet first sa hard rock cafe in Hong Kong. They had free use of a computer and internet. Pre teen pa lang ako noon so i just added .com to cartoonetwork and nickelodeon. haha.,0.1116666666666666,0.395,positive,kx2o6oo,t3_1bqd4eq,False
1bqd4eq,,,This is so cool 🥺,1,,,1711701652.0,2024-03-29 16:40:52,EmbarrassedWillow721,,,comment,This is so cool 🥺,0.35,0.65,positive,kx30rue,t3_1bqd4eq,False
1bqd4eq,,,Sa pldt VITRO sa may Makati ave ba ito ginawa?,1,,,1711706235.0,2024-03-29 17:57:15,NoticeObjective,,,comment,Sa pldt VITRO sa may Makati ave ba ito ginawa?,0.0,0.0,neutral,kx36tx1,t3_1bqd4eq,False
1bqd4eq,,,WOW this is cool,1,,,1711710962.0,2024-03-29 19:16:02,KeepMeCrisp,,,comment,WOW this is cool,0.2249999999999999,0.825,positive,kx3dxyd,t3_1bqd4eq,False
1bqd4eq,,,r/Damnthatsinteresting,1,,,1711714650.0,2024-03-29 20:17:30,paradoX2618,,,comment,r/Damnthatsinteresting,0.0,0.0,neutral,kx3kpqo,t3_1bqd4eq,False
1bqd4eq,,,im amazed! and my university being the only one from mindanao!,1,,,1711715672.0,2024-03-29 20:34:32,ConversationOk9965,,,comment,im amazed! and my university being the only one from mindanao!,0.0,1.0,neutral,kx3mtvt,t3_1bqd4eq,False
1bqd4eq,,,The pioneer.,1,,,1711721893.0,2024-03-29 22:18:13,UtasNaButas29,,,comment,The pioneer.,0.0,0.0,neutral,kx41v0n,t3_1bqd4eq,False
1bqd4eq,,,The Balut server,1,,,1711722305.0,2024-03-29 22:25:05,Potential-Tadpole-32,,,comment,The Balut server,0.0,0.0,neutral,kx42zid,t3_1bqd4eq,False
1bqd4eq,,,Oh man. This is so cool. It's been 30 years. It feels like a completely different lifetime.,1,,,1711722507.0,2024-03-29 22:28:27,jenn4u2luv,,,comment,Oh man. This is so cool. It's been 30 years. It feels like a completely different lifetime.,0.175,0.625,positive,kx43jmt,t3_1bqd4eq,False
1bqd4eq,,,this is a really cool post 🥹,1,,,1711722873.0,2024-03-29 22:34:33,Familiar_Raccoon4877,,,comment,this is a really cool post 🥹,0.35,0.65,positive,kx44k4l,t3_1bqd4eq,False
1bqd4eq,,,first time to connect to internet was in 1999. and only opened google,1,,,1711725047.0,2024-03-29 23:10:47,epeolatry13,,,comment,first time to connect to internet was in 1999. and only opened google,0.125,0.6666666666666666,positive,kx4apbo,t3_1bqd4eq,False
1bqd4eq,,,"Saw a circulating post mentioning ""70,00"" and some listing the router as $70,000 so I thought it confused the Cisco model '7000' with being worth '70,000' USD, but then it turns out it's actually worth more than $70,000 -- however this is for the current market price since Cisco *still* produces the 7000 model range. A more accurate value of the Cisco 7000 back in 1994 would be $19,900 or around Php550,000 without a Silicon SwitchProcessor, and in 2024, that amount would be worth $41,670 or a little over 2 million pesos.",1,,,1711725586.0,2024-03-29 23:19:46,zaafiel8,,,comment,"Saw a circulating post mentioning ""70,00"" and some listing the router as $70,000 so I thought it confused the Cisco model '7000' with being worth '70,000' USD, but then it turns out it's actually worth more than $70,000 -- however this is for the current market price since Cisco *still* produces the 7000 model range. A more accurate value of the Cisco 7000 back in 1994 would be $19,900 or around Php550,000 without a Silicon SwitchProcessor, and in 2024, that amount would be worth $41,670 or a little over 2 million pesos.",0.17125,0.3533333333333333,positive,kx4c8dj,t3_1bqd4eq,False
1bqd4eq,,,First time I encountered the internet was at the DLSU library near CBE and COS,1,,,1711725618.0,2024-03-29 23:20:18,madocs,,,comment,First time I encountered the internet was at the DLSU library near CBE and COS,0.175,0.3666666666666667,positive,kx4cboo,t3_1bqd4eq,False
1k7eytq,,,University students' straw poll results don't reflect the would-be outcome of the 2025 midterm election. I'm afraid to say that these are the least demographic sector that will show up in the precinct on Election Day.,14,,,1745566424.0,2025-04-25 15:33:44,Joseph20102011,,,comment,University students' straw poll results don't reflect the would-be outcome of the 2025 midterm election. I'm afraid to say that these are the least demographic sector that will show up in the precinct on Election Day.,-0.4499999999999999,0.65,negative,moxlwr7,t3_1k7eytq,False
1k7eytq,,,"University level sya; madalas naman talaga yung mga ""tamang kandidato"" ang nasa lead pag sa kanila. Yung sa ""regular"" demographic sana ganyan ang result pero alam naman natin...",5,,,1745569044.0,2025-04-25 16:17:24,,,,comment,"University level sya; madalas naman talaga yung mga ""tamang kandidato"" ang nasa lead pag sa kanila. Yung sa ""regular"" demographic sana ganyan ang result pero alam naman natin...",0.0,0.0769230769230769,neutral,moxq3tm,t3_1k7eytq,False
1k7eytq,,,Disappointed hindi man lang nakapasok si Ka Dodoy Ballon,4,,,1745569431.0,2025-04-25 16:23:51,amiD_13,,,comment,Disappointed hindi man lang nakapasok si Ka Dodoy Ballon,-0.75,0.75,negative,moxqpez,t3_1k7eytq,False
1k7eytq,,,"Keep spreading polls like this, balance out those ""popular"" surveys. Yaan nyo ngumawa yung mga nagsasabing "" school survey *lang* yan eh"" Keep posting!",2,,,1745723201.0,2025-04-27 11:06:41,Queldaralion,,,comment,"Keep spreading polls like this, balance out those ""popular"" surveys. Yaan nyo ngumawa yung mga nagsasabing "" school survey *lang* yan eh"" Keep posting!",0.75,0.9,positive,mp96ny4,t3_1k7eytq,False
1k7eytq,,,"It's more on na wala pa silang first-hand knowledge sa maruming politika during childhood at adolescence years at nakadepende lang sa kanilang mga university professors, especially sa liberal arts courses, so mas idealistic ang viewpoint nila sa politika at ang gusto na solution ay more on theoretical na hindi pa nasusubukan. The more na exposed ka sa politics, the more na maging cynical ka, to the point na mas madali ka nang madala sa right-wing talkpoints.",6,,,1745583911.0,2025-04-25 20:25:11,Joseph20102011,,,comment,"It's more on na wala pa silang first-hand knowledge sa maruming politika during childhood at adolescence years at nakadepende lang sa kanilang mga university professors, especially sa liberal arts courses, so mas idealistic ang viewpoint nila sa politika at ang gusto na solution ay more on theoretical na hindi pa nasusubukan. The more na exposed ka sa politics, the more na maging cynical ka, to the point na mas madali ka nang madala sa right-wing talkpoints.",0.1999999999999999,0.5857142857142856,positive,moyioj6,t1_moxq3tm,False
180v7yi,,,"Have you heard of the orphanage on Mindanao in Ozamis? Cherish Hearts Children's Home houses 34 children and includes four classrooms, two washing facilities, a dining room and a kitchen. Here is more information on the USC class that helped achieve her dream of ""doing good"" in the Philippines: [",3,,,1700610462.0,2023-11-22 07:47:42,USCDornsifeNews,,,comment,"Have you heard of the orphanage on Mindanao in Ozamis? Cherish Hearts Children's Home houses 34 children and includes four classrooms, two washing facilities, a dining room and a kitchen. Here is more information on the USC class that helped achieve her dream of ""doing good"" in the Philippines: [",0.15,0.7000000000000001,positive,ka8bpie,t3_180v7yi,True
180v7yi,,,Good for her. This is out of reach of reality but Japan should consider taking in families with kids in the Philippines to restore their population.,-1,,,1700645458.0,2023-11-22 17:30:58,,,,comment,Good for her. This is out of reach of reality but Japan should consider taking in families with kids in the Philippines to restore their population.,0.7,0.6000000000000001,positive,kaa40or,t3_180v7yi,False
180v7yi,,,This is the whitest-ever post on this subreddit.,1,,,1700682913.0,2023-11-23 03:55:13,VectorSam,,,comment,This is the whitest-ever post on this subreddit.,0.0,0.0,neutral,kacdfr7,t3_180v7yi,False
10gt12d,,,"I wasn't a student in either but I do interact with graduates of both universities. For context, I'm remotely running a business in Central and Western Visayas and my managers are from USC and Siliman. Alums from both are very competent. In terms of performance (and this is just anecdotal), USC alums have been performing slightly better for the last 2 years.",7,,,1674217201.0,2023-01-20 20:20:01,NoConsideration5775,,,comment,"I wasn't a student in either but I do interact with graduates of both universities. For context, I'm remotely running a business in Central and Western Visayas and my managers are from USC and Siliman. Alums from both are very competent. In terms of performance (and this is just anecdotal), USC alums have been performing slightly better for the last 2 years.",0.175,0.3138888888888889,positive,j54uqc1,t3_10gt12d,False
10gt12d,,,"Studied in Silliman. Finished about a decade ago. I have siblings and relatives who went to USC. Depends on what course you're gonna take. Back in my day College of Engineering kinda sucked at SU. Maybe they got better over the years. Main difference between the two are the cities they're in. Cebu is highly urbanized. Personally d ko feel ang big city life. Dumaguete on the other hand, even if city siya is a pretty laid back university town. Another big difference is uniform. Silliman walang uniform. Kahit shorts na pambahay ka at tsinelas okay lang (except for some courses like Nursing).",5,,,1674218759.0,2023-01-20 20:45:59,tokwa_doodles,,,comment,"Studied in Silliman. Finished about a decade ago. I have siblings and relatives who went to USC. Depends on what course you're gonna take. Back in my day College of Engineering kinda sucked at SU. Maybe they got better over the years. Main difference between the two are the cities they're in. Cebu is highly urbanized. Personally d ko feel ang big city life. Dumaguete on the other hand, even if city siya is a pretty laid back university town. Another big difference is uniform. Silliman walang uniform. Kahit shorts na pambahay ka at tsinelas okay lang (except for some courses like Nursing).",0.1319696969696969,0.3407575757575757,positive,j54xe4x,t3_10gt12d,False
10gt12d,,,"Glad i saw this! Been also eyeing USC, but at the same time torn between staying Silliman or nah since its definitely chill, less traffic, away from pollution, and def accessible. But at the same time, eyeing for other universities outside Dumaguete for myself to grow and discover something some in big cities. Wew gon be a life changing decision talaga.",2,,,1674302771.0,2023-01-21 20:06:11,IntentionEconomy9180,,,comment,"Glad i saw this! Been also eyeing USC, but at the same time torn between staying Silliman or nah since its definitely chill, less traffic, away from pollution, and def accessible. But at the same time, eyeing for other universities outside Dumaguete for myself to grow and discover something some in big cities. Wew gon be a life changing decision talaga.",0.0787037037037037,0.3018518518518518,neutral,j59p3xy,t3_10gt12d,False
10gt12d,,,I'm having the same issue. Does anyone know how good the BS Psych program is at SU? I just came back from a visit to SU (the campus is SO CALMING) and heard good things about how Psych students are doing but I wanna hear a more subjective pov. Many thanks to anyone who could help out!,1,,,1680057642.0,2023-03-29 10:40:42,The_Golden_Eye_1884,,,comment,I'm having the same issue. Does anyone know how good the BS Psych program is at SU? I just came back from a visit to SU (the campus is SO CALMING) and heard good things about how Psych students are doing but I wanna hear a more subjective pov. Many thanks to anyone who could help out!,0.3785714285714285,0.3607142857142857,positive,je3ccju,t3_10gt12d,False
