post_id,subreddit,title,text,score,upvote_ratio,num_comments,created_utc,created_date,author,url,permalink,content_type,combined_text,polarity,subjectivity,sentiment_category,comment_id,parent_id,is_submitter
10gt12d,,,"USC or SU truly depends on what your priorities are. If you're a city girlie, choose USC. If you like the trees, good ambience, environment, choose SU. In terms of objectivity, choose USC if you're in the fields of PolSci, Accounting, Business Ad., Psychology, Engineering, Bio, Mathematics, Physics, Chem, etc. Choose SU if you're in the fields of Nursing, Med Tech, PT, OT, Marine Bio.",1,,,1682425811.0,2023-04-25 20:30:11,woahwoahvicky,,,comment,"USC or SU truly depends on what your priorities are. If you're a city girlie, choose USC. If you like the trees, good ambience, environment, choose SU. In terms of objectivity, choose USC if you're in the fields of PolSci, Accounting, Business Ad., Psychology, Engineering, Bio, Mathematics, Physics, Chem, etc. Choose SU if you're in the fields of Nursing, Med Tech, PT, OT, Marine Bio.",0.7,0.6000000000000001,positive,jhn7bp4,t3_10gt12d,False
10gt12d,,,"Thank you for sharing your experience and opinions about both fo the schools! Any information helps! I mean I personally didn't know SU was COE in some medical fields. I guess one of the strengths of SU if you compare it to USC is the cheaper tuition, at least that's what most of my friends say but they haven't gone there yet. They say SU tuition is cheaper than USC (Of course still expensive because private school), is that really the case?",1,,,1674344448.0,2023-01-22 07:40:48,Dizzy-Bed-9013,,,comment,"Thank you for sharing your experience and opinions about both fo the schools! Any information helps! I mean I personally didn't know SU was COE in some medical fields. I guess one of the strengths of SU if you compare it to USC is the cheaper tuition, at least that's what most of my friends say but they haven't gone there yet. They say SU tuition is cheaper than USC (Of course still expensive because private school), is that really the case?",-0.0515625,0.3953125,neutral,j5cc9i3,t1_j5975jr,True
10gt12d,,,"Yeah, it is a very life-changing decision. Scary at first glance, but hey in the end I think we will make the right choice. If not the right choice, then the choice that might be good for us in the long run. I wish you luck in the future man! Lezgo!",2,,,1674344575.0,2023-01-22 07:42:55,Dizzy-Bed-9013,,,comment,"Yeah, it is a very life-changing decision. Scary at first glance, but hey in the end I think we will make the right choice. If not the right choice, then the choice that might be good for us in the long run. I wish you luck in the future man! Lezgo!",0.1464285714285714,0.478720238095238,positive,j5cckhv,t1_j59p3xy,True
10gt12d,,,"For my course (Sociology) vs my siblings' courses (Architecture and Psychology), mas expensive ang USC. I was not a honor student during my high school, but with SU I was able to get scholarships bec I was a dean's lister, student assistant and active in the student government. The co-curriculars helped me land on my current job after I graduated. Check out the tuition and scholarships between both universities for your course. Weigh in the living expenses that you'll be spending for Cebu or Dumaguete.",2,,,1674357785.0,2023-01-22 11:23:05,poppoppaoo,,,comment,"For my course (Sociology) vs my siblings' courses (Architecture and Psychology), mas expensive ang USC. I was not a honor student during my high school, but with SU I was able to get scholarships bec I was a dean's lister, student assistant and active in the student government. The co-curriculars helped me land on my current job after I graduated. Check out the tuition and scholarships between both universities for your course. Weigh in the living expenses that you'll be spending for Cebu or Dumaguete.",0.0053333333333333,0.573,neutral,j5d6nmt,t1_j5cc9i3,False
10gt12d,,,"THANK YOUUU 🙌 This was really helpful. See you soon, SU!!",1,,,1682151479.0,2023-04-22 16:17:59,The_Golden_Eye_1884,,,comment,"THANK YOUUU 🙌 This was really helpful. See you soon, SU!!",0.3125,0.2,positive,jh8yi7j,t1_jh8y0iy,False
10gt12d,,,"Oh yeah, the living expenses. You are right, thanks. I've always heard that living in Cebu would be slightly expensive, if not more expensive than Dumaguete. Hmm I'll definitely take living expenses into consideration, very much so, because I am not even from Dumaguete or Cebu. Okay thanks for the tippp. It is very appreciated!",2,,,1674359563.0,2023-01-22 11:52:43,Dizzy-Bed-9013,,,comment,"Oh yeah, the living expenses. You are right, thanks. I've always heard that living in Cebu would be slightly expensive, if not more expensive than Dumaguete. Hmm I'll definitely take living expenses into consideration, very much so, because I am not even from Dumaguete or Cebu. Okay thanks for the tippp. It is very appreciated!",0.0520714285714285,0.4225714285714286,neutral,j5dac8g,t1_j5d6nmt,True
10gt12d,,,"Hi, may I ask po about some details on being a student assistant? I am interested po kasi to apply but don't have anybody to ask for some of the specifics.",1,,,1685973846.0,2023-06-05 22:04:06,MitchiMarbleEyes,,,comment,"Hi, may I ask po about some details on being a student assistant? I am interested po kasi to apply but don't have anybody to ask for some of the specifics.",0.25,0.5,positive,jmzn13v,t1_j5d6nmt,False
10gt12d,,,"Hi! You can apply upon admissions and enrollment, through the Student Affairs: scholarship and aid division. There are qualifications you have to maintain as a SA (student assistant), and you have to choose which department you want to be assigned to, and provide a copy of your schedule so that they can help you arrange the work hours and allowance. If you're planning to visit SU, the office is at Oriental Hall, 2nd floor. Aside from checking out the SA option, checkout the scholarships available for your course or college. More details here: I was a SA at the Alumni and International Students office during my 2nd-3rd year. I eventually stopped being an SA bec of schedule conflicts w/ my course internship/fieldwork and involvement with the student govt/council, but I still managed to qualify and maintain the academic scholarship :)",1,,,1685977548.0,2023-06-05 23:05:48,poppoppaoo,,,comment,"Hi! You can apply upon admissions and enrollment, through the Student Affairs: scholarship and aid division. There are qualifications you have to maintain as a SA (student assistant), and you have to choose which department you want to be assigned to, and provide a copy of your schedule so that they can help you arrange the work hours and allowance. If you're planning to visit SU, the office is at Oriental Hall, 2nd floor. Aside from checking out the SA option, checkout the scholarships available for your course or college. More details here: I was a SA at the Alumni and International Students office during my 2nd-3rd year. I eventually stopped being an SA bec of schedule conflicts w/ my course internship/fieldwork and involvement with the student govt/council, but I still managed to qualify and maintain the academic scholarship :)",0.2333333333333333,0.3166666666666666,positive,jmzvume,t1_jmzn13v,False
lkfjc0,,,"Government is creating another fake ""kidnapping"" case to justify arrests of activists.",10,,,1613402405.0,2021-02-15 23:20:05,gradenko_2000,,,comment,"Government is creating another fake ""kidnapping"" case to justify arrests of activists.",-0.5,1.0,negative,gnjh8s9,t3_lkfjc0,False
lkfjc0,,,"Excerpt: > It, thus, came as a surprise that reports about minors being ""rescued"" surfaced today. While COSA mentioned that some parents were coming over to fetch their children, it did not dawn on us that the parents' visit will necessitate the presence of policemen. > Here, no rescue need ever be conducted because the presence of the lumads in the retreat house was for their welfare and well-being, and all throughout, they were nurtured, cared for, and treated with their best interest in mind.",6,,,1613402073.0,2021-02-15 23:14:33,krdskrm9,,,comment,"Excerpt: > It, thus, came as a surprise that reports about minors being ""rescued"" surfaced today. While COSA mentioned that some parents were coming over to fetch their children, it did not dawn on us that the parents' visit will necessitate the presence of policemen. > Here, no rescue need ever be conducted because the presence of the lumads in the retreat house was for their welfare and well-being, and all throughout, they were nurtured, cared for, and treated with their best interest in mind.",1.0,0.3,positive,gnjgn1q,t3_lkfjc0,True
lkfjc0,,,Suenugin yang chief of police.,1,,,1613445278.0,2021-02-16 11:14:38,,,,comment,Suenugin yang chief of police.,0.0,0.0,neutral,gnluzq2,t3_lkfjc0,False
lkfjc0,,,This is exactly it.,1,,,1613411023.0,2021-02-16 01:43:43,,,,comment,This is exactly it.,0.25,0.25,positive,gnjyquq,t1_gnjh8s9,False
lkfjc0,,,"The statement does [Edit: not] ~~some~~ seem to include that the group stayed there ***willingly***, only that they have been ""cared for."" &nbsp; Edit: Whoops, like what u/krdskrm9 wrote, it is supposed to read ""does NOT seem""",1,,,1613445504.0,2021-02-16 11:18:24,Menter33,,,comment,"The statement does [Edit: not] ~~some~~ seem to include that the group stayed there ***willingly***, only that they have been ""cared for."" &nbsp; Edit: Whoops, like what u/krdskrm9 wrote, it is supposed to read ""does NOT seem""",0.0,1.0,neutral,gnlvelk,t1_gnjgn1q,False
lkfjc0,,,"If the parents are there, then don't they have the ***parental right*** to get their children back? If things are in order with the parents, then this looks like an organization keeping children away from their legal guardians. &nbsp; (Double whammy too since religious organization have had ***scandals and serious issues*** involving young kids.) &nbsp; *** Yup, that was a typo in the comment; tried to change it.",1,,,1613475397.0,2021-02-16 19:36:37,Menter33,,,comment,"If the parents are there, then don't they have the ***parental right*** to get their children back? If things are in order with the parents, then this looks like an organization keeping children away from their legal guardians. &nbsp; (Double whammy too since religious organization have had ***scandals and serious issues*** involving young kids.) &nbsp; *** Yup, that was a typo in the comment; tried to change it.",0.0360544217687074,0.2931972789115646,neutral,gnmxu4z,t1_gnly4jw,False
lkfjc0,,,"Actually, their Datu is with them. There is always a stereotype that Catholic priests are molesters, but these teens are actually looked after by professors. Edit: The group was scheduled to go back April 2020, and by that time Cebu was in total lockdown having the most with cases (I've known parents of friends dying that time). Now, if they have to travel noe, they also need to pay for the testing which can be 6k to avail.",2,,,1613559895.0,2021-02-17 19:04:55,IllustriousLychee13,,,comment,"Actually, their Datu is with them. There is always a stereotype that Catholic priests are molesters, but these teens are actually looked after by professors. Edit: The group was scheduled to go back April 2020, and by that time Cebu was in total lockdown having the most with cases (I've known parents of friends dying that time). Now, if they have to travel noe, they also need to pay for the testing which can be 6k to avail.",0.0833333333333333,0.2583333333333333,neutral,gnr4ywv,t1_gnmxu4z,False
1aznyr1,,,Why the hell would NPA send these people to the front lines? She had a bright future ahead and could literally make a difference for our country.,94,,,1708897900.0,2024-02-26 05:51:40,XoxoXo0110,,,comment,Why the hell would NPA send these people to the front lines? She had a bright future ahead and could literally make a difference for our country.,0.35,0.4624999999999999,positive,ks4mcxa,t3_1aznyr1,False
1aznyr1,,,Ano pa ba aasahan sa Anakbayan? Jusko puro pagtatanggol sa NPA nalalaman,17,,,1708931758.0,2024-02-26 15:15:58,JammyRPh,,,comment,Ano pa ba aasahan sa Anakbayan? Jusko puro pagtatanggol sa NPA nalalaman,0.0,0.0,neutral,ks6rhf3,t3_1aznyr1,False
1aznyr1,,,Watching that recent video of the attack helo The Purchase of those t129 attack helos really changed the equation huh? Imagine watching helplesslly as your fellow commies gets pulverized and you cant even shoot back or run since it can see you even in pitch darkness.,48,,,1708909179.0,2024-02-26 08:59:39,SyiGG,,,comment,Watching that recent video of the attack helo The Purchase of those t129 attack helos really changed the equation huh? Imagine watching helplesslly as your fellow commies gets pulverized and you cant even shoot back or run since it can see you even in pitch darkness.,0.0666666666666666,0.15,neutral,ks5g96a,t3_1aznyr1,False
1aznyr1,,,"NPA and their forever ""revolution"" 5 decades already passed and no significant gain at this point they're just being a nuisance doing banditry shit, they should just stop, its not just worth it anymore their ideology will not be accepted by the people.",38,,,1708910673.0,2024-02-26 09:24:33,Literally_Me_2011,,,comment,"NPA and their forever ""revolution"" 5 decades already passed and no significant gain at this point they're just being a nuisance doing banditry shit, they should just stop, its not just worth it anymore their ideology will not be accepted by the people.",-0.0291666666666666,0.5916666666666667,neutral,ks5k0dd,t3_1aznyr1,False
1aznyr1,,,"They never intend to stop the stupid shit government does, they intend to become the new management. Insetitan meme* I mean damn, you're def smabut you clearly never understood what it means fighting against a decent military force which is the AFP. Being a lawyer could have done more. But hey, who am I to make other people's decisions. I guess they felt utter hopelessness (if you do, pls don't send yourself on a suicide mission: you'll end up as a poster for some politicians or in this case a political group). Fighting lopsided battles won't win you a war. Like ohmaygad, cheering on fighters just blurs the line between a peaceful political group and armed revolutionaries. No wonder anakbayan getting redtagged. Oh and trust me, dying as a revolutionary is the easy way out of this mess.",66,,,1708884823.0,2024-02-26 02:13:43,nyanmunchkins,,,comment,"They never intend to stop the stupid shit government does, they intend to become the new management. Insetitan meme* I mean damn, you're def smabut you clearly never understood what it means fighting against a decent military force which is the AFP. Being a lawyer could have done more. But hey, who am I to make other people's decisions. I guess they felt utter hopelessness (if you do, pls don't send yourself on a suicide mission: you'll end up as a poster for some politicians or in this case a political group). Fighting lopsided battles won't win you a war. Like ohmaygad, cheering on fighters just blurs the line between a peaceful political group and armed revolutionaries. No wonder anakbayan getting redtagged. Oh and trust me, dying as a revolutionary is the easy way out of this mess.",0.043420550038197,0.5128374076903489,neutral,ks3kk0z,t3_1aznyr1,False
1aznyr1,,,"So do they admit na NPA siya or is this ""red-tagging"" again? lol",34,,,1708907653.0,2024-02-26 08:34:13,Loud_Movie1981,,,comment,"So do they admit na NPA siya or is this ""red-tagging"" again? lol",0.8,0.7,positive,ks5cd0i,t3_1aznyr1,False
1aznyr1,,,Bakit hindi ubusin ng mga NPA yung mga political dynasties? Panay revolutionary tax sa private sector ang ginagawa.,100,,,1708872354.0,2024-02-25 22:45:54,Mindless-Papaya5996,,,comment,Bakit hindi ubusin ng mga NPA yung mga political dynasties? Panay revolutionary tax sa private sector ang ginagawa.,0.0,0.2375,neutral,ks2le49,t3_1aznyr1,False
1aznyr1,,,"Yeah. Their ""armed revolution"" is dead. My sibling used to say that they will have ""armed revolution"" and they will join. Now, they relocated somewhere where they aren't recognized by the army.",34,,,1708903936.0,2024-02-26 07:32:16,surewhynotdammit,,,comment,"Yeah. Their ""armed revolution"" is dead. My sibling used to say that they will have ""armed revolution"" and they will join. Now, they relocated somewhere where they aren't recognized by the army.",-0.2,0.4,negative,ks52u0n,t3_1aznyr1,False
1aznyr1,,,Anakbayan: we're not connected to any Marxists movements and NPA also them na nagluluksa kapag may NPA na napapatay,8,,,1708987075.0,2024-02-27 06:37:55,Opening_Stuff1165,,,comment,Anakbayan: we're not connected to any Marxists movements and NPA also them na nagluluksa kapag may NPA na napapatay,0.0,0.0,neutral,ksae4w6,t3_1aznyr1,False
1aznyr1,,,Fuck the NPA at mga fronts nila tulad ng Anakbayan at LFS. Kapal ng mukha nilang umiyak ng red-tagging pag nabbrimg up eh totoo namang nanglalason sila ng isip para maging terorista. Sila ang main reason why activism is so stigmatized in the Philippines. Kasing sama lang nila yung gobyernong kalaban nila.,83,,,1708888119.0,2024-02-26 03:08:39,,,,comment,Fuck the NPA at mga fronts nila tulad ng Anakbayan at LFS. Kapal ng mukha nilang umiyak ng red-tagging pag nabbrimg up eh totoo namang nanglalason sila ng isip para maging terorista. Sila ang main reason why activism is so stigmatized in the Philippines. Kasing sama lang nila yung gobyernong kalaban nila.,-0.1166666666666666,0.4666666666666667,negative,ks3u6cd,t3_1aznyr1,False
1aznyr1,,,Oh no! Anyway...,8,,,1708922213.0,2024-02-26 12:36:53,,,,comment,Oh no! Anyway...,0.0,0.0,neutral,ks6aye0,t3_1aznyr1,False
1aznyr1,,,"A lot here would say she could have done more practicing law. What people seems to forget, she is a social justice activist, sooner or later she will take on big corporates, politicians and influencial people. Kidnapping, EJK, riding in tandem will not be too far away from her. She choose to fight in her own terms and died for it. Rightly or wrongly she made a choice. Not many are able.",16,,,1708938626.0,2024-02-26 17:10:26,kankarology,,,comment,"A lot here would say she could have done more practicing law. What people seems to forget, she is a social justice activist, sooner or later she will take on big corporates, politicians and influencial people. Kidnapping, EJK, riding in tandem will not be too far away from her. She choose to fight in her own terms and died for it. Rightly or wrongly she made a choice. Not many are able.",0.1092592592592592,0.5212962962962963,positive,ks717at,t3_1aznyr1,False
1aznyr1,,,Bruh they are getting smashed by T129s in Negros as well. BZ to our AFP 🇵🇭,52,,,1708871703.0,2024-02-25 22:35:03,Ragnarsson12,,,comment,Bruh they are getting smashed by T129s in Negros as well. BZ to our AFP 🇵🇭,0.0,0.0,neutral,ks2ju1c,t3_1aznyr1,False
1aznyr1,,,"Thank you AFP! 🫡 All communists must die! A good communist, is a dead communist.",9,,,1708922924.0,2024-02-26 12:48:44,,,,comment,"Thank you AFP! 🫡 All communists must die! A good communist, is a dead communist.",0.2499999999999999,0.5,positive,ks6cdcz,t3_1aznyr1,False
1aznyr1,,,"Gone are the days when they only targeted corrupt police, journalists and politicians. Now, they forcibly collect revolutionary taxes from local peasants and businessmen. So go eff yourselves to extinction NPA.",13,,,1708908214.0,2024-02-26 08:43:34,avocado1952,,,comment,"Gone are the days when they only targeted corrupt police, journalists and politicians. Now, they forcibly collect revolutionary taxes from local peasants and businessmen. So go eff yourselves to extinction NPA.",0.0,0.75,neutral,ks5dsjk,t3_1aznyr1,False
1aznyr1,,,"a life wasted, tangina ng NPA at bakit siya sumali, sayang ang potential nya bilang abogado",8,,,1708911683.0,2024-02-26 09:41:23,ichie666,,,comment,"a life wasted, tangina ng NPA at bakit siya sumali, sayang ang potential nya bilang abogado",-0.1,0.5,neutral,ks5mjnr,t3_1aznyr1,False
1aznyr1,,,the only good communist is a dead one ☠️,37,,,1708871610.0,2024-02-25 22:33:30,setsunasaihanadare,,,comment,the only good communist is a dead one ☠️,0.1666666666666666,0.6666666666666666,positive,ks2jluc,t3_1aznyr1,False
1aznyr1,,,"Sayang, you can always serve the country in more productive ways.",6,,,1708911371.0,2024-02-26 09:36:11,tikolman,,,comment,"Sayang, you can always serve the country in more productive ways.",0.5,0.5,positive,ks5lrha,t3_1aznyr1,False
1aznyr1,,,"Lol. Parang nung pagtawag lang ng WaPo sa dead ISIS leader na ""austere religious scholar""",4,,,1708914725.0,2024-02-26 10:32:05,talongbao,,,comment,"Lol. Parang nung pagtawag lang ng WaPo sa dead ISIS leader na ""austere religious scholar""",0.2,0.45,positive,ks5u37p,t3_1aznyr1,False
1aznyr1,,,"""So, ano pa pinaglalaban natin?"" -Tado, on live TV",7,,,1708901763.0,2024-02-26 06:56:03,SechsWurfel,,,comment,"""So, ano pa pinaglalaban natin?"" -Tado, on live TV",0.1363636363636363,0.5,positive,ks4x2zq,t3_1aznyr1,False
1aznyr1,,,"I think it's time to create new leftist movements that veer awqy from these traditional ""opposition"" parties that use such violence-leaning means.",2,,,1708940733.0,2024-02-26 17:45:33,Queldaralion,,,comment,"I think it's time to create new leftist movements that veer awqy from these traditional ""opposition"" parties that use such violence-leaning means.",0.021590909090909,0.5761363636363637,neutral,ks740ey,t3_1aznyr1,False
1aznyr1,,,"Sayang ang life niya. Bakit pinili niya ang armed revolution as a member of NPA? Bakit hindi siya nagenlist para maging government soldier? Bakit hindi na lang siya nag apply sa government then make a change para mapabuti ang mga nasa laylayan? Ano ang plano ng Anakbayan? Dapat ang members ng Anakbayan, mag apply kayo sa government then maging officials para magkaroon ng change.",16,,,1708870952.0,2024-02-25 22:22:32,no_balls_crystal,,,comment,"Sayang ang life niya. Bakit pinili niya ang armed revolution as a member of NPA? Bakit hindi siya nagenlist para maging government soldier? Bakit hindi na lang siya nag apply sa government then make a change para mapabuti ang mga nasa laylayan? Ano ang plano ng Anakbayan? Dapat ang members ng Anakbayan, mag apply kayo sa government then maging officials para magkaroon ng change.",0.0,0.0,neutral,ks2i2je,t3_1aznyr1,False
1aznyr1,,,Proof na kahit educated ka doesnt mean matalino ka. Nakakahinayang.,2,,,1708908688.0,2024-02-26 08:51:28,navatanelah,,,comment,Proof na kahit educated ka doesnt mean matalino ka. Nakakahinayang.,-0.3125,0.6875,negative,ks5f088,t3_1aznyr1,False
1aznyr1,,,Philippines eliminating their bad investments😎,2,,,1708918341.0,2024-02-26 11:32:21,jan_sun,,,comment,Philippines eliminating their bad investments😎,-0.6999999999999998,0.6666666666666666,negative,ks62mbt,t3_1aznyr1,False
1aznyr1,,,"Highlands, argentina, purefoods, delimondo, hormel",1,,,1708875233.0,2024-02-25 23:33:53,throwhuawei007,,,comment,"Highlands, argentina, purefoods, delimondo, hormel",0.0,0.0,neutral,ks2strz,t3_1aznyr1,False
1aznyr1,,,"Kung tutuusin, hindi niyo masisisi ang mga sambayanan na tumungo sa kanayunan at tahakin ang pinakamataas na porma ng pakikibaka dahil ang kabulukan na po mismo ng estado ang nagtutulak sa ibang sektor ng lipunan para sumapi sa armadong pakikibaka. Malalim ang ugat ng armadong pakikibaka at hanggat hindi ito nabibigyan ng solusyon, mananatili ang kagustuhan ng nilang tumangan ng armas. Ika nga nila, sa patuloy na pagigting ng kondisyong nagpapahirap sa masang Pilipino, mas lalo itong mag-aanak ng mga rebolusyonaryong handang magbuwis para sa bayan at sa masang Pilipino! Hangga't may karahasan at kagutoman, patuloy at patuloy na magluluwal ang lipunan ng pinakamagigiting at pinakamatatapang na pulang mandirigma. TOTOO NA MARAHAS ANG DIGMAAN, SUBALIT MAS MARAHAS ANG MGA DAHILAN NITO - ANG KAWALAN NG LUPA, PANDARAMBONG SA LUPANG NINUNO, KAWALAN NG NAKABUBUHAY NA SAHOD, KAWALAN NG KATARUNGAN, NAKATALING INHUSTIYA, AT KAHIRAPAN!",1,,,1714890146.0,2024-05-05 14:22:26,DesignerPopular4062,,,comment,"Kung tutuusin, hindi niyo masisisi ang mga sambayanan na tumungo sa kanayunan at tahakin ang pinakamataas na porma ng pakikibaka dahil ang kabulukan na po mismo ng estado ang nagtutulak sa ibang sektor ng lipunan para sumapi sa armadong pakikibaka. Malalim ang ugat ng armadong pakikibaka at hanggat hindi ito nabibigyan ng solusyon, mananatili ang kagustuhan ng nilang tumangan ng armas. Ika nga nila, sa patuloy na pagigting ng kondisyong nagpapahirap sa masang Pilipino, mas lalo itong mag-aanak ng mga rebolusyonaryong handang magbuwis para sa bayan at sa masang Pilipino! Hangga't may karahasan at kagutoman, patuloy at patuloy na magluluwal ang lipunan ng pinakamagigiting at pinakamatatapang na pulang mandirigma. TOTOO NA MARAHAS ANG DIGMAAN, SUBALIT MAS MARAHAS ANG MGA DAHILAN NITO - ANG KAWALAN NG LUPA, PANDARAMBONG SA LUPANG NINUNO, KAWALAN NG NAKABUBUHAY NA SAHOD, KAWALAN NG KATARUNGAN, NAKATALING INHUSTIYA, AT KAHIRAPAN!",0.0,0.0,neutral,l2nknb3,t3_1aznyr1,False
1aznyr1,,,"Actions, meet consequences. Hahahahaha",0,,,1708911868.0,2024-02-26 09:44:28,Pasencia,,,comment,"Actions, meet consequences. Hahahahaha",0.2,0.6,positive,ks5n0e4,t3_1aznyr1,False
1aznyr1,,,"She's not a lawyer, though. Anyway, the replies here are sick. Typical reddit.",-12,,,1708875908.0,2024-02-25 23:45:08,krdskrm9,,,comment,"She's not a lawyer, though. Anyway, the replies here are sick. Typical reddit.",-0.4404761904761904,0.6785714285714286,negative,ks2uoe4,t3_1aznyr1,False
1aznyr1,,,Nagrereklamo kayo sa gobyerno pero nagpapalakpakan kayo pag may namatay na aktibista.,-6,,,1708879084.0,2024-02-26 00:38:04,,,,comment,Nagrereklamo kayo sa gobyerno pero nagpapalakpakan kayo pag may namatay na aktibista.,0.0,0.0,neutral,ks33ozx,t3_1aznyr1,False
1aznyr1,,,good riddance,-14,,,1708874976.0,2024-02-25 23:29:36,mic2324445,,,comment,good riddance,0.7,0.6000000000000001,positive,ks2s4uq,t3_1aznyr1,False
