post_id,subreddit,title,text,score,upvote_ratio,num_comments,created_utc,created_date,author,url,permalink,content_type,combined_text,polarity,subjectivity,sentiment_category,comment_id,parent_id,is_submitter
1aznyr1,,,Nakakalungkot,0,,,1708935634.0,2024-02-26 16:20:34,nuknukan,,,comment,Nakakalungkot,0.0,0.0,neutral,ks6x4m4,t3_1aznyr1,False
1aznyr1,,,If you have an idea about the russia-ukraine war you'll know that armed struggles are now on a whole level of expensive because of drones. And it's a sign of how corrupt the AFP is that the NPA can even operate in the mountains.,-25,,,1708873686.0,2024-02-25 23:08:06,auirinvest,,,comment,If you have an idea about the russia-ukraine war you'll know that armed struggles are now on a whole level of expensive because of drones. And it's a sign of how corrupt the AFP is that the NPA can even operate in the mountains.,-0.2666666666666666,0.7000000000000001,negative,ks2oq69,t3_1aznyr1,False
1aznyr1,,,Salot talaga tong mga NPA nato. Sayang ang buhay ni ate.,1,,,1708970279.0,2024-02-27 01:57:59,,,,comment,Salot talaga tong mga NPA nato. Sayang ang buhay ni ate.,0.0,0.0,neutral,ks8zjdg,t3_1aznyr1,False
1aznyr1,,,Good riddance,1,,,1709031002.0,2024-02-27 18:50:02,Saint_Elsewhere101,,,comment,Good riddance,0.7,0.6000000000000001,positive,kscwsfi,t3_1aznyr1,False
1aznyr1,,,Ang weird nang malaman mo na yung ka-schoolmate mo dati ay naging NPA at namatay sa shoot-out.,55,,,1708904214.0,2024-02-26 07:36:54,Eggplant-Vivid,,,comment,Ang weird nang malaman mo na yung ka-schoolmate mo dati ay naging NPA at namatay sa shoot-out.,-0.5,1.0,negative,ks53jv7,t1_ks4mcxa,False
1aznyr1,,,Makes good propaganda.,39,,,1708902828.0,2024-02-26 07:13:48,AgileCartoonist396,,,comment,Makes good propaganda.,0.3,0.35,positive,ks4zxyg,t1_ks4mcxa,False
1aznyr1,,,"Doesnt really matter even if it's Lenin himself, the NPA will send anyone that can hold a gun to fight for their ""cause"", had she stayed in one of their legal fronts she may at least had a chance to help the public But she chose to die alongside glorified bandits in the dark muddy ground in the mountains",55,,,1708909630.0,2024-02-26 09:07:10,SyiGG,,,comment,"Doesnt really matter even if it's Lenin himself, the NPA will send anyone that can hold a gun to fight for their ""cause"", had she stayed in one of their legal fronts she may at least had a chance to help the public But she chose to die alongside glorified bandits in the dark muddy ground in the mountains",-0.0099999999999999,0.2533333333333333,neutral,ks5hdy3,t1_ks4mcxa,False
1aznyr1,,,"To give rise to a ""martyr""",5,,,1708948670.0,2024-02-26 19:57:50,AdFickle2013,,,comment,"To give rise to a ""martyr""",0.0,0.0,neutral,ks7fme8,t1_ks4mcxa,False
1aznyr1,,,Imagine if we had this beast in the 90's and early 2000's a lot of casualties could've been avoided and the insurgents processed into ground beef.,17,,,1708923644.0,2024-02-26 13:00:44,ianlasco,,,comment,Imagine if we had this beast in the 90's and early 2000's a lot of casualties could've been avoided and the insurgents processed into ground beef.,0.1,0.3,neutral,ks6drhm,t1_ks5g96a,False
1aznyr1,,,Do you have a link?,3,,,1708915863.0,2024-02-26 10:51:03,UltimateArchduke,,,comment,Do you have a link?,0.0,0.0,neutral,ks5wu08,t1_ks5g96a,False
1aznyr1,,,"Hi u/nyanmunchkins, if you or someone you know is contemplating suicide, please do not hesitate to [talk to someone]( who may be able to help. *** *I am a bot, and this action was performed automatically. Please [contact the moderators of this subreddit](/message/compose/?to=/r/Philippines) if you have any questions or concerns.*",-3,,,1708884823.0,2024-02-26 02:13:43,AutoModerator,,,comment,"Hi u/nyanmunchkins, if you or someone you know is contemplating suicide, please do not hesitate to [talk to someone]( who may be able to help. *** *I am a bot, and this action was performed automatically. Please [contact the moderators of this subreddit](/message/compose/?to=/r/Philippines) if you have any questions or concerns.*",0.3,0.3625,positive,ks3kk38,t1_ks3kk0z,False
1aznyr1,,,Let's wait for the **BIASED** mods to decide. Lol!,13,,,1708924249.0,2024-02-26 13:10:49,,,,comment,Let's wait for the **BIASED** mods to decide. Lol!,1.0,0.7,positive,ks6ewj8,t1_ks5cd0i,False
1aznyr1,,,Ha! Possibly because the political dynasties are also their biggest recruitment tool!,31,,,1708872680.0,2024-02-25 22:51:20,ps2332,,,comment,Ha! Possibly because the political dynasties are also their biggest recruitment tool!,0.0,0.55,neutral,ks2m6wu,t1_ks2le49,False
1aznyr1,,,"Hindi kaya dahil hindi sila ganun kalakas o ka-organisado para manugod ng isang tauhan ng political dynasty? Mga repormista ngang gusto pakulong si Quiboloy o ipa-ICC si Duterte eh hindi magawa, mga tulisan pa kaya na hindi makalaban sa AFP? Tyaka pusta ko decentralisado ang NPA kasi kung organisado yan hindi yan natatalo ng ganito kadali lang.",-9,,,1708879724.0,2024-02-26 00:48:44,,,,comment,"Hindi kaya dahil hindi sila ganun kalakas o ka-organisado para manugod ng isang tauhan ng political dynasty? Mga repormista ngang gusto pakulong si Quiboloy o ipa-ICC si Duterte eh hindi magawa, mga tulisan pa kaya na hindi makalaban sa AFP? Tyaka pusta ko decentralisado ang NPA kasi kung organisado yan hindi yan natatalo ng ganito kadali lang.",0.0,0.1,neutral,ks35jm2,t1_ks2le49,False
1aznyr1,,,Grabe yung paulan nang bala nung blackhawk. Rinig na rinig yung brrrt.,9,,,1708905954.0,2024-02-26 08:05:54,zucksucksmyberg,,,comment,Grabe yung paulan nang bala nung blackhawk. Rinig na rinig yung brrrt.,0.0,0.0,neutral,ks580tx,t1_ks2ju1c,False
1bdnkng,,,"babe wake up, new phr4r univ ranking dropped",241,,,1710325824.0,2024-03-13 18:30:24,bastardnomore,,,comment,"babe wake up, new phr4r univ ranking dropped",0.1363636363636363,0.4545454545454545,positive,kunnwki,t3_1bdnkng,False
1bdnkng,,,I'm not sure which traffic is worse -university belt or katipunan lol,30,,,1710344487.0,2024-03-13 23:41:27,PantherCaroso,,,comment,I'm not sure which traffic is worse -university belt or katipunan lol,0.05,0.7296296296296297,neutral,kuovmzr,t3_1bdnkng,False
1bdnkng,,,wohoi phr4r patch notes is up,44,,,1710340347.0,2024-03-13 22:32:27,100___gecs,,,comment,wohoi phr4r patch notes is up,0.0,0.0,neutral,kuojnn8,t3_1bdnkng,False
1bdnkng,,,Still not impressive if we're talking about ranking in ASEAN,14,,,1710375223.0,2024-03-14 08:13:43,,,,comment,Still not impressive if we're talking about ranking in ASEAN,-0.5,1.0,negative,kurfgqy,t3_1bdnkng,False
1bdnkng,,,"I have no problem with 90% of their criteria, but the remaining 10% being calculated from wikipedia views is just lol",11,,,1710377156.0,2024-03-14 08:45:56,rootofimaginary,,,comment,"I have no problem with 90% of their criteria, but the remaining 10% being calculated from wikipedia views is just lol",0.8,0.7,positive,kurkr79,t3_1bdnkng,False
1bdnkng,,,"""Breeding ground yan ng mga Kumunista!"" --DDtards",20,,,1710371637.0,2024-03-14 07:13:57,SinongKeith,,,comment,"""Breeding ground yan ng mga Kumunista!"" --DDtards",0.0,0.0,neutral,kur5m4w,t3_1bdnkng,False
1bdnkng,,,grabeha sa msu marawi oy 🫶 kong di lang hadlok skwelahan,8,,,1710353905.0,2024-03-14 02:18:25,ms-idgf,,,comment,grabeha sa msu marawi oy 🫶 kong di lang hadlok skwelahan,0.0,0.0,neutral,kupojkc,t3_1bdnkng,False
1bdnkng,,,Top 1 din daw sa salary delays ang Peyups.,36,,,1710326992.0,2024-03-13 18:49:52,_lechonk_kawali_,,,comment,Top 1 din daw sa salary delays ang Peyups.,0.5,0.5,positive,kunpqyp,t3_1bdnkng,False
1bdnkng,,,naligaw nanaman mapua dito a,12,,,1710342383.0,2024-03-13 23:06:23,sweetpotato2304,,,comment,naligaw nanaman mapua dito a,0.0,0.0,neutral,kuoph6o,t3_1bdnkng,False
1bdnkng,,,i just know ateneans are fuming because lasalle grabbed their spot 😂,12,,,1710367324.0,2024-03-14 06:02:04,spiritbananaMD,,,comment,i just know ateneans are fuming because lasalle grabbed their spot 😂,0.0,0.0,neutral,kuqtbn2,t3_1bdnkng,False
1bdnkng,,,"shift to trisem pa kayo mapua ah, lagapak tuloy sa rankings hahahahahaha",11,,,1710336935.0,2024-03-13 21:35:35,4espa,,,comment,"shift to trisem pa kayo mapua ah, lagapak tuloy sa rankings hahahahahaha",0.0,0.0,neutral,kuoadwj,t3_1bdnkng,False
1bdnkng,,,Bagsak lahat haha,3,,,1710345475.0,2024-03-13 23:57:55,kankarology,,,comment,Bagsak lahat haha,0.2,0.3,positive,kuoymlo,t3_1bdnkng,False
1bdnkng,,,I wonder how do they fare compared to other ASEAN universities.,2,,,1710386530.0,2024-03-14 11:22:10,,,,comment,I wonder how do they fare compared to other ASEAN universities.,-0.125,0.375,negative,kus8rge,t3_1bdnkng,False
1bdnkng,,,"Doesn't matter, team diskarte! -DDShits",2,,,1710421448.0,2024-03-14 21:04:08,,,,comment,"Doesn't matter, team diskarte! -DDShits",0.0,0.0,neutral,kuturzj,t3_1bdnkng,False
1bdnkng,,,Nasaan Jose Maria College? Fakenews to /s,2,,,1710344733.0,2024-03-13 23:45:33,DumbExa,,,comment,Nasaan Jose Maria College? Fakenews to /s,0.0,0.0,neutral,kuowdgw,t3_1bdnkng,False
1bdnkng,,,Anyone wanna grab popcorn as this unfolds?,1,,,1710375023.0,2024-03-14 08:10:23,CallMeero,,,comment,Anyone wanna grab popcorn as this unfolds?,0.0,0.0,neutral,kurewur,t3_1bdnkng,False
1bdnkng,,,Phr4r males and ladies screaming and revising their scripts right now what is now the meta big 4.,1,,,1710379198.0,2024-03-14 09:19:58,,,,comment,Phr4r males and ladies screaming and revising their scripts right now what is now the meta big 4.,0.1428571428571428,0.3178571428571428,positive,kurq7z5,t3_1bdnkng,False
1bdnkng,,,tbh sobrang behind ang mga university sa Pilipinas compared sa ibang bansa yung computer science na lang sa UP mukhang stuck sa 2000. So parang gago lang kung magpapataasan kayo ng ihi dahil taas ng school nyo kumpara sa ibang uni sa Pinas.,1,,,1710440625.0,2024-03-15 02:23:45,Wadix9000f,,,comment,tbh sobrang behind ang mga university sa Pilipinas compared sa ibang bansa yung computer science na lang sa UP mukhang stuck sa 2000. So parang gago lang kung magpapataasan kayo ng ihi dahil taas ng school nyo kumpara sa ibang uni sa Pinas.,-0.4,0.7,negative,kuveb8v,t3_1bdnkng,False
1bdnkng,,,Mapua went from 4 to 9 in a shoperiod of time.,1,,,1711553577.0,2024-03-27 23:32:57,,,,comment,Mapua went from 4 to 9 in a shoperiod of time.,0.0,0.3,neutral,kwt7nvt,t3_1bdnkng,False
1bdnkng,,,"The fact that our ""best"" university ranks 1367th in the world tells a lot about our education system. Hopefully, someone wouldn't use the ""third world country"" card. There are other non-first world countries with universities that rank high. Ever seen the ASEAN rankings?",1,,,1711553744.0,2024-03-27 23:35:44,,,,comment,"The fact that our ""best"" university ranks 1367th in the world tells a lot about our education system. Hopefully, someone wouldn't use the ""third world country"" card. There are other non-first world countries with universities that rank high. Ever seen the ASEAN rankings?",0.0469999999999999,0.423,neutral,kwt85zw,t3_1bdnkng,False
1bdnkng,,,Methodology reveal muna,-3,,,1710336442.0,2024-03-13 21:27:22,peenoisee,,,comment,Methodology reveal muna,0.0,0.0,neutral,kuo94ok,t3_1bdnkng,False
1bdnkng,,,which MSU tho?,1,,,1710327215.0,2024-03-13 18:53:35,taxms,,,comment,which MSU tho?,0.0,0.0,neutral,kunq47f,t3_1bdnkng,False
1bdnkng,,,First time hearing Asian Institute of Management. San yun?,0,,,1710377822.0,2024-03-14 08:57:02,Ok_Strawberry_888,,,comment,First time hearing Asian Institute of Management. San yun?,0.125,0.1666666666666666,positive,kurmk3h,t3_1bdnkng,False
1bdnkng,,,Bashing galore na naman to lmao,-2,,,1710328103.0,2024-03-13 19:08:23,magmaknuckles,,,comment,Bashing galore na naman to lmao,0.6,1.0,positive,kunrlqu,t3_1bdnkng,False
1bdnkng,,,"As far as im concered, there are only two. UP, and others. Wahahahahahaha",-56,,,1710326838.0,2024-03-13 18:47:18,keepitsimple_tricks,,,comment,"As far as im concered, there are only two. UP, and others. Wahahahahahaha",0.05,1.0,neutral,kunpi0j,t3_1bdnkng,False
1bdnkng,,,Hahahahaha real,17,,,1710326161.0,2024-03-13 18:36:01,,,,comment,Hahahahaha real,0.2,0.45,positive,kunofn5,t1_kunnwki,False
1bdnkng,,,Dapat sa phr4r subreddit ito pinost.,10,,,1710338827.0,2024-03-13 22:07:07,Maritess_56,,,comment,Dapat sa phr4r subreddit ito pinost.,0.0,0.0,neutral,kuofeuk,t1_kunnwki,False
1bdnkng,,,r/alasjuicy creaming their pants right now,3,,,1710375141.0,2024-03-14 08:12:21,,,,comment,r/alasjuicy creaming their pants right now,0.2857142857142857,0.5357142857142857,positive,kurf8hv,t1_kunnwki,False
1bdnkng,,,nag update yung tier list,1,,,1710376695.0,2024-03-14 08:38:15,pociac,,,comment,nag update yung tier list,0.0,0.0,neutral,kurji8l,t1_kunnwki,False
1bdnkng,,,Katipunan. At least sa University Belt naka-commute karamihan ng tao.,17,,,1710371334.0,2024-03-14 07:08:54,SquirtleBob164,,,comment,Katipunan. At least sa University Belt naka-commute karamihan ng tao.,-0.3,0.4,negative,kur4s91,t1_kuovmzr,False
1bdnkng,,,Mag MSU- IIT ka,2,,,1710377431.0,2024-03-14 08:50:31,kwengst,,,comment,Mag MSU- IIT ka,0.0,0.0,neutral,kurlhxo,t1_kupojkc,False
1bdnkng,,,"Bakit Peyups ang tawag sa UP? Nakita ko noon yung subreddit na yan ang name, akala ko tuloy ay PUP.",16,,,1710336974.0,2024-03-13 21:36:14,masterpieces_,,,comment,"Bakit Peyups ang tawag sa UP? Nakita ko noon yung subreddit na yan ang name, akala ko tuloy ay PUP.",0.0,0.0,neutral,kuoahkw,t1_kunpqyp,False
1bdnkng,,,Parang hindi naman ata talaga nakakapasok Mapua sa top 5?,14,,,1710341201.0,2024-03-13 22:46:41,Mayari-,,,comment,Parang hindi naman ata talaga nakakapasok Mapua sa top 5?,0.5,0.5,positive,kuom2sh,t1_kuoadwj,False
1bdnkng,,,"Wasn't Mapua better when it had 2 sems? Quarterm is just too fast tbh, not enough time to let the concepts marinate",14,,,1710358002.0,2024-03-14 03:26:42,friidum-boya,,,comment,"Wasn't Mapua better when it had 2 sems? Quarterm is just too fast tbh, not enough time to let the concepts marinate",0.2333333333333333,0.5333333333333333,positive,kuq10rj,t1_kuoadwj,False
1bdnkng,,,"thought it was quarter-sem, not tri-sem for mapua, which was coincidentally implemented when the yuchengco group entered the administration. (at this point, **mapua is basically malayan colleges** but the yuchengcos decided to keep the ""mapua"" name.)",3,,,1710387528.0,2024-03-14 11:38:48,Menter33,,,comment,"thought it was quarter-sem, not tri-sem for mapua, which was coincidentally implemented when the yuchengco group entered the administration. (at this point, **mapua is basically malayan colleges** but the yuchengcos decided to keep the ""mapua"" name.)",0.0,0.0,neutral,kusb0wl,t1_kuoadwj,False
1bdnkng,,,"honestly, I don't think so, I think what they said in the Trisem orientation made sense. I see benefits there. They even claimed that trisem does not ""prolong"" one's duration in the university. As being there would take 84 weeks from the usual 88 weeks (since we are currently in the third term). Additionally, the price is ideally the same. It's cheaper without the optional summer classes but it becomes the same price with summerclasses with units up to 24 (18 (regular load) + 6 (load from summer classes). We are also told that we get two weeks per term with a 4-week summer break, for the rest of the 10 weeks. I honestly feel very convinced by this. The only thing that I kinda fear are the professors. But then again, professors are said to be given more time since trisem gives more leeway for preparation because of the extra 3 weeks from the 11 weeks.",2,,,1710425724.0,2024-03-14 22:15:24,melody_melon23,,,comment,"honestly, I don't think so, I think what they said in the Trisem orientation made sense. I see benefits there. They even claimed that trisem does not ""prolong"" one's duration in the university. As being there would take 84 weeks from the usual 88 weeks (since we are currently in the third term). Additionally, the price is ideally the same. It's cheaper without the optional summer classes but it becomes the same price with summerclasses with units up to 24 (18 (regular load) + 6 (load from summer classes). We are also told that we get two weeks per term with a 4-week summer break, for the rest of the 10 weeks. I honestly feel very convinced by this. The only thing that I kinda fear are the professors. But then again, professors are said to be given more time since trisem gives more leeway for preparation because of the extra 3 weeks from the 11 weeks.",0.2178571428571429,0.4412087912087911,positive,kuu5s7p,t1_kuoadwj,False
1bdnkng,,,me na nakapag-register na sa mapua (chem eng): :|,2,,,1710338828.0,2024-03-13 22:07:08,NadieTheAviatrix,,,comment,me na nakapag-register na sa mapua (chem eng): :|,0.0,0.0,neutral,kuofeze,t1_kuoadwj,False
1bdnkng,,,"Ikaw yata motivation nito at ng thread 🤭 😂 But, honestly bruh, where's your hate coming from?",1,,,1711554687.0,2024-03-27 23:51:27,,,,comment,"Ikaw yata motivation nito at ng thread 🤭 😂 But, honestly bruh, where's your hate coming from?",-0.1,0.9,negative,kwtb1lf,t1_kunm9rd,False
1bdnkng,,,"TRUT. I really don't know kung saan hinuhugot ng mga iba yung superiority complex, e jusme ang meh lang naman ng rankings. That's the fact. Pride for school, I understand, pero yung SC talaga hindi ko maunawaan",1,,,1711552737.0,2024-03-27 23:18:57,,,,comment,"TRUT. I really don't know kung saan hinuhugot ng mga iba yung superiority complex, e jusme ang meh lang naman ng rankings. That's the fact. Pride for school, I understand, pero yung SC talaga hindi ko maunawaan",-0.0499999999999999,0.3,neutral,kwt55r8,t1_kuveb8v,False
1bdnkng,,,>Methodology reveal muna Looks like someone doesn't like the rankings,16,,,1710350592.0,2024-03-14 01:23:12,SourcerorSoupreme,,,comment,>Methodology reveal muna Looks like someone doesn't like the rankings,0.0,0.0,neutral,kupeayp,t1_kuo94ok,False
1bdnkng,,,I'm a UST grad and tama ka jan.,2,,,1711753056.0,2024-03-30 06:57:36,LeaferMessiah,,,comment,I'm a UST grad and tama ka jan.,0.0,0.0,neutral,kx6dajk,t1_kurpqdk,False
1bdnkng,,,me thinks this is MSU Marawi,1,,,1710330704.0,2024-03-13 19:51:44,devon_chan,,,comment,me thinks this is MSU Marawi,0.0,0.0,neutral,kunwb80,t1_kunq47f,False
1bdnkng,,,"Lol, sa may tapat ng greenbelt 1. Pang MBA yan. Sila nga lang ung MBA na recognised ng mga ibang univ",2,,,1710393792.0,2024-03-14 13:23:12,peterparkerson,,,comment,"Lol, sa may tapat ng greenbelt 1. Pang MBA yan. Sila nga lang ung MBA na recognised ng mga ibang univ",0.8,0.7,positive,kusn8gb,t1_kurmk3h,False
1kskcv7,,,At first look he looks like someone I know...,4,,,1747898481.0,2025-05-22 15:21:21,cyianite,,,comment,At first look he looks like someone I know...,0.25,0.3333333333333333,positive,mtm8197,t3_1kskcv7,False
1kskcv7,,,Para namang si Rannie Raymundo,1,,,1747953131.0,2025-05-23 06:32:11,Adorable-Map9889,,,comment,Para namang si Rannie Raymundo,0.0,0.0,neutral,mtqjcxg,t3_1kskcv7,False
1i2pjm5,,,"Dapat naman talaga kinakalaban ang estado, lalo na kung estadong putangina na tulad dito. A state that does not serve its people does not deserve to persist. The only justifiable position for such a nebulous, all-encompassing entity is as a thrall, otherwise it's a crowd-computing version of HAL-9000. The problem is you leftoids are so deep-fried in rhetoric and your precious dialectics that only bog you down in perpetual analysis paralysis and alienate you from the masses you claim to fight for. This is the innate flaw in having the entire basis for your belief system be rooted in the unemployed ramblings of an ""ideas guy"" who hasn't lifted anything heavy in his life. If you could drop your stupid new age faux-religion and see clearly for once about what needs fixing and what can be done about it without having to follow the prescriptions of some little red book, MAYBE you can get somewhere.",15,,,1737038643.0,2025-01-16 22:44:03,billiamthestrange,,,comment,"Dapat naman talaga kinakalaban ang estado, lalo na kung estadong putangina na tulad dito. A state that does not serve its people does not deserve to persist. The only justifiable position for such a nebulous, all-encompassing entity is as a thrall, otherwise it's a crowd-computing version of HAL-9000. The problem is you leftoids are so deep-fried in rhetoric and your precious dialectics that only bog you down in perpetual analysis paralysis and alienate you from the masses you claim to fight for. This is the innate flaw in having the entire basis for your belief system be rooted in the unemployed ramblings of an ""ideas guy"" who hasn't lifted anything heavy in his life. If you could drop your stupid new age faux-religion and see clearly for once about what needs fixing and what can be done about it without having to follow the prescriptions of some little red book, MAYBE you can get somewhere.",-0.0505576599326599,0.6043139730639729,neutral,m7gg7ng,t3_1i2pjm5,False
1i2pjm5,,,'Di na talaga mawawala infighting within the left. Napaka unproductive eh pare-parehas lang naman mareredtag because the average Filipino can't tell the difference between socialism and communism haha,9,,,1737038190.0,2025-01-16 22:36:30,yeppeugiman,,,comment,'Di na talaga mawawala infighting within the left. Napaka unproductive eh pare-parehas lang naman mareredtag because the average Filipino can't tell the difference between socialism and communism haha,0.0166666666666666,0.2333333333333333,neutral,m7geuy0,t3_1i2pjm5,False
1i2pjm5,,,"They are the legal front. Even though they did nothing illegal. We know they are sympathetic however, we can't be unlawful in trying to bring them down.",7,,,1737036542.0,2025-01-16 22:09:02,Charming-Recording39,,,comment,"They are the legal front. Even though they did nothing illegal. We know they are sympathetic however, we can't be unlawful in trying to bring them down.",0.0111111111111111,0.4972222222222222,neutral,m7ga0ks,t3_1i2pjm5,False
1i2pjm5,,,akala talaga ng karamihan pareho lang yung akbayan and anakbayan when in reality eh rival groups sila. Yung akbayan nag condemn ng mga atrocities ng CPP-NPA.,5,,,1737046573.0,2025-01-17 00:56:13,,,,comment,akala talaga ng karamihan pareho lang yung akbayan and anakbayan when in reality eh rival groups sila. Yung akbayan nag condemn ng mga atrocities ng CPP-NPA.,0.0,0.0,neutral,m7h6qhb,t3_1i2pjm5,False
1i2pjm5,,,"Naging bahagi din nmn ang Akbayan sa pagtutol sa jeepney modernization program (nasa fb page ng Akbayan youth, so di ko mashare), at sa pagtutol sa Chacha. The way I see it, unti lang talaga ang mga miyembro ng Akbayan. Also, common na ang laftist infighting sa kahit anong spaces, mas ok nga ngayon kasi noon, mas madugo ang infighting.",3,,,1737037606.0,2025-01-16 22:26:46,CryptographerVast673,,,comment,"Naging bahagi din nmn ang Akbayan sa pagtutol sa jeepney modernization program (nasa fb page ng Akbayan youth, so di ko mashare), at sa pagtutol sa Chacha. The way I see it, unti lang talaga ang mga miyembro ng Akbayan. Also, common na ang laftist infighting sa kahit anong spaces, mas ok nga ngayon kasi noon, mas madugo ang infighting.",0.1,0.5,neutral,m7gd4t2,t3_1i2pjm5,False
1i2pjm5,,,The Marxist were called by someone more Marxist than them. -- Yuri Bezmenov,3,,,1737041443.0,2025-01-16 23:30:43,Madsszzz,,,comment,The Marxist were called by someone more Marxist than them. -- Yuri Bezmenov,0.5,0.5,positive,m7gp5j6,t3_1i2pjm5,False
1i2pjm5,,,Important to point out that some of these aren't actually students and are just trolls. DLSU USG and other pages tied to DLSU organizations have been seeing comments and reactions from troll accounts for a while now.,7,,,1737037773.0,2025-01-16 22:29:33,D-S_12,,,comment,Important to point out that some of these aren't actually students and are just trolls. DLSU USG and other pages tied to DLSU organizations have been seeing comments and reactions from troll accounts for a while now.,0.0916666666666666,0.4916666666666667,neutral,m7gdmhk,t3_1i2pjm5,False
1i2pjm5,,,Easy to hide behind reax,3,,,1737036593.0,2025-01-16 22:09:53,jollibeehappy,,,comment,Easy to hide behind reax,0.0166666666666666,0.7666666666666666,neutral,m7ga5s3,t3_1i2pjm5,False
1i2pjm5,,,"What else are those workers' strikes that we need to be aware of? Pertaining to that b0 commenter. I am aware of the NutriAsia one however may halong media censorship nga lang siya, and Jollibee lalo na sa US (if kasama rin yun).",3,,,1737036645.0,2025-01-16 22:10:45,Stunning-Day-356,,,comment,"What else are those workers' strikes that we need to be aware of? Pertaining to that b0 commenter. I am aware of the NutriAsia one however may halong media censorship nga lang siya, and Jollibee lalo na sa US (if kasama rin yun).",0.25,0.25,positive,m7gab8h,t3_1i2pjm5,False
1i2pjm5,,,Do you think campuses need more diversity in terms of political ideologies?,3,,,1737038014.0,2025-01-16 22:33:34,kjm_234,,,comment,Do you think campuses need more diversity in terms of political ideologies?,0.25,0.3,positive,m7gec62,t3_1i2pjm5,False
1i2pjm5,,,"Interesting point about them not being seen during strikes. Reminds me of one article referring to Hontiveros as paof the liberal elite, together with Robredo and Pangilinan.",1,,,1737094200.0,2025-01-17 14:10:00,tokwamann,,,comment,"Interesting point about them not being seen during strikes. Reminds me of one article referring to Hontiveros as paof the liberal elite, together with Robredo and Pangilinan.",0.5,0.5,positive,m7l6ogq,t3_1i2pjm5,False
