post_id,subreddit,title,text,score,upvote_ratio,num_comments,created_utc,created_date,author,url,permalink,content_type,combined_text,polarity,subjectivity,sentiment_category,comment_id,parent_id,is_submitter
1bqd4eq,Philippines,The night Benjie Tan hooked up the Phillipines to the internet,full story,3558,0.99,173.0,1711676616.0,2024-03-29 09:43:36,throwawaygirl1111110,https://i.redd.it/vmtqgdudh6rc1.jpeg,https://reddit.com/r/Philippines/comments/1bqd4eq/the_night_benjie_tan_hooked_up_the_phillipines_to/,post,The night Benjie Tan hooked up the Phillipines to the internet full story,0.35,0.55,positive,,,
1k7eytq,Philippines,"Kiko-Bam, Kabataan top University of San Carlos 2025 mock poll.",,19,0.76,5.0,1745565616.0,2025-04-25 15:20:16,InternetEmployee,https://www.reddit.com/gallery/1k7eytq,https://reddit.com/r/Philippines/comments/1k7eytq/kikobam_kabataan_top_university_of_san_carlos/,post,"Kiko-Bam, Kabataan top University of San Carlos 2025 mock poll.",0.5,0.5,positive,,,
1jh2czy,Philippines,30 4th-Year CS Students of the University of San Carlos Held Back From Graduating,,1,1.0,1.0,1742625177.0,2025-03-22 14:32:57,NoodleSushi,https://imgur.com/a/quUxplW,https://reddit.com/r/Philippines/comments/1jh2czy/30_4thyear_cs_students_of_the_university_of_san/,post,30 4th-Year CS Students of the University of San Carlos Held Back From Graduating,0.0,0.0,neutral,,,
180v7yi,Philippines,USC student opens orphanage in the Philippines after taking a nonprofit startup class,,21,0.86,4.0,1700610348.0,2023-11-22 07:45:48,USCDornsifeNews,https://dailytrojan.com/2023/10/23/marshall-alum-creates-nonprofit-builds-orphanage-in-the-philippines/,https://reddit.com/r/Philippines/comments/180v7yi/usc_student_opens_orphanage_in_the_philippines/,post,USC student opens orphanage in the Philippines after taking a nonprofit startup class,0.0,0.0,neutral,,,
10gt12d,Philippines,Silliman University or University of San Carlos,"I am a bit torn between the both of them. I don't know if I should study undergraduate in Silliman or in the University of San Carlos. I know both of them are great schools, USC being more popular, but I want to hear ideas, experiences, and opinions about the schools. The information you give or saying whatever you want to say will be greatly appreciated!",9,0.85,15.0,1674208603.0,2023-01-20 17:56:43,Dizzy-Bed-9013,https://www.reddit.com/r/Philippines/comments/10gt12d/silliman_university_or_university_of_san_carlos/,https://reddit.com/r/Philippines/comments/10gt12d/silliman_university_or_university_of_san_carlos/,post,"Silliman University or University of San Carlos I am a bit torn between the both of them. I don't know if I should study undergraduate in Silliman or in the University of San Carlos. I know both of them are great schools, USC being more popular, but I want to hear ideas, experiences, and opinions about the schools. The information you give or saying whatever you want to say will be greatly appreciated!",0.5375,0.5625,positive,,,
lkfjc0,Philippines,"Joint statement of the Archdiocese of Cebu, SVD Philippines Southern Province, and University of San Carlos",,35,0.93,9.0,1613401870.0,2021-02-15 23:11:10,krdskrm9,https://i.redd.it/nytq5m3lqnh61.jpg,https://reddit.com/r/Philippines/comments/lkfjc0/joint_statement_of_the_archdiocese_of_cebu_svd/,post,"Joint statement of the Archdiocese of Cebu, SVD Philippines Southern Province, and University of San Carlos",0.0,0.0,neutral,,,
1aznyr1,Philippines,"Anakbayan' tribute to the death of ""revolutionary"" lawyer..",Oh well.. A dead NPA revolutionary.,104,0.74,138.0,1708867828.0,2024-02-25 21:30:28,winterreise_1827,https://www.reddit.com/gallery/1aznyr1,https://reddit.com/r/Philippines/comments/1aznyr1/anakbayan_tribute_to_the_death_of_revolutionary/,post,"Anakbayan' tribute to the death of ""revolutionary"" lawyer.. Oh well.. A dead NPA revolutionary.",-0.2,0.4,negative,,,
1bdnkng,Philippines,Top 10 Universities in the Philippines 2024,,208,0.94,72.0,1710323505.0,2024-03-13 17:51:45,titancipher,https://i.redd.it/z83nytqop2oc1.jpeg,https://reddit.com/r/Philippines/comments/1bdnkng/top_10_universities_in_the_philippines_2024/,post,Top 10 Universities in the Philippines 2024,0.5,0.5,positive,,,
1i2pjm5,Philippines,"""Bakit kami palagi nireredtag?"" Campus Leftists:","Parte ako ng progresibong kaliwa pero grabe nakakadismaya talaga na makita ito sa mga kapwa-estudyante. Estudyante ako sa isang SUC and karamihan sa mga aktibo sa politics na kilala ko (USC, Student Pubs) ay puro ideologically aligned sa radical left Akbayan and other moderate leftist parties yung paraan natin para makapagsulong ng tunay na pagbabago pero ayaw nila sa kanila kase ""hindi nila kinakalaban ang estado?""",0,0.43,17.0,1737036078.0,2025-01-16 22:01:18,Yellow-Cabinet,https://www.reddit.com/gallery/1i2pjm5,https://reddit.com/r/Philippines/comments/1i2pjm5/bakit_kami_palagi_nireredtag_campus_leftists/,post,"""Bakit kami palagi nireredtag?"" Campus Leftists: Parte ako ng progresibong kaliwa pero grabe nakakadismaya talaga na makita ito sa mga kapwa-estudyante. Estudyante ako sa isang SUC and karamihan sa mga aktibo sa politics na kilala ko (USC, Student Pubs) ay puro ideologically aligned sa radical left Akbayan and other moderate leftist parties yung paraan natin para makapagsulong ng tunay na pagbabago pero ayaw nila sa kanila kase ""hindi nila kinakalaban ang estado?""",-0.04375,0.4187499999999999,neutral,,,
14l2pnf,Philippines,Five Philippine universities were included in the Quacquarelli Symonds (QS) World University Rankings 2024.,"The University of the Philippines emerged as the top Philippine institution, followed by Ateneo de Manila University, De La Salle University, University of Santo Tomas, and University of San Carlos. The QS ranks institutions through the following performance lenses: academic reputation, citations per faculty, employer reputation, employer outcomes, faculty-student ratio, international faculty, international research network, international students, and sustainability.",8,0.79,5.0,1687937081.0,2023-06-28 15:24:41,Hatt-Patt,https://i.redd.it/eqrtq41knp8b1.jpg,https://reddit.com/r/Philippines/comments/14l2pnf/five_philippine_universities_were_included_in_the/,post,"Five Philippine universities were included in the Quacquarelli Symonds (QS) World University Rankings 2024. The University of the Philippines emerged as the top Philippine institution, followed by Ateneo de Manila University, De La Salle University, University of Santo Tomas, and University of San Carlos. The QS ranks institutions through the following performance lenses: academic reputation, citations per faculty, employer reputation, employer outcomes, faculty-student ratio, international faculty, international research network, international students, and sustainability.",0.0833333333333333,0.0999999999999999,neutral,,,
1lhjtz5,Cebu,University of San Carlos,"Hi guys, ask lang ko sa inyo tots sa usc especially ddto sa talamban campus. Incoming freshie diay ko nga ganahan lang makabalo sa experiences sa tao og kamusta ang usc especially sa ilang industrial engineering department.",4,0.67,10.0,1750584273.0,2025-06-22 17:24:33,Unique_Reading7178,https://www.reddit.com/r/Cebu/comments/1lhjtz5/university_of_san_carlos/,https://reddit.com/r/Cebu/comments/1lhjtz5/university_of_san_carlos/,post,"University of San Carlos Hi guys, ask lang ko sa inyo tots sa usc especially ddto sa talamban campus. Incoming freshie diay ko nga ganahan lang makabalo sa experiences sa tao og kamusta ang usc especially sa ilang industrial engineering department.",0.0,1.0,neutral,,,
1hs9b3c,Cebu,V hire terminal from University of San Carlos to Toledo,Hi. Mangutana lang asa nga Univ of San Carlos diri sa Cebu ang dool sa may V Hire terminal going to Toledo. Will be going to Negros Occidental unta. Upon checking man gyod lima man diay ang campus sa Univ of San Carlos dri Cebu. HELLLP.,1,0.67,10.0,1735864374.0,2025-01-03 08:32:54,licealis,https://www.reddit.com/r/Cebu/comments/1hs9b3c/v_hire_terminal_from_university_of_san_carlos_to/,https://reddit.com/r/Cebu/comments/1hs9b3c/v_hire_terminal_from_university_of_san_carlos_to/,post,V hire terminal from University of San Carlos to Toledo Hi. Mangutana lang asa nga Univ of San Carlos diri sa Cebu ang dool sa may V Hire terminal going to Toledo. Will be going to Negros Occidental unta. Upon checking man gyod lima man diay ang campus sa Univ of San Carlos dri Cebu. HELLLP.,0.0,0.0,neutral,,,
1cddc8z,Cebu,Imee Marcos in University of San Carlos,[sauce]( Naunsa gud ni ang San Carlos? Pila man ilang dawat ani? [They (SSC)]( openly endorsed Leni-Kiko tandem last election but now this? Mas naa pa'y kabuot ilang mga studyante kaysa sa mga head. Wa pud uro'y maikog sa Cebu 7!,38,0.91,21.0,1714108971.0,2024-04-26 13:22:51,chickennnnnuggets,https://www.reddit.com/r/Cebu/comments/1cddc8z/imee_marcos_in_university_of_san_carlos/,https://reddit.com/r/Cebu/comments/1cddc8z/imee_marcos_in_university_of_san_carlos/,post,Imee Marcos in University of San Carlos [sauce]( Naunsa gud ni ang San Carlos? Pila man ilang dawat ani? [They (SSC)]( openly endorsed Leni-Kiko tandem last election but now this? Mas naa pa'y kabuot ilang mga studyante kaysa sa mga head. Wa pud uro'y maikog sa Cebu 7!,0.0,0.2833333333333333,neutral,,,
1e2y64b,Cebu,University of San Carlos tuition fee?,Hi mangutana lang ko ba kung pilay tuition fee sa san carlos bs bio?,1,1.0,7.0,1720949326.0,2024-07-14 17:28:46,WalkerUnknown,https://www.reddit.com/r/Cebu/comments/1e2y64b/university_of_san_carlos_tuition_fee/,https://reddit.com/r/Cebu/comments/1e2y64b/university_of_san_carlos_tuition_fee/,post,University of San Carlos tuition fee? Hi mangutana lang ko ba kung pilay tuition fee sa san carlos bs bio?,0.0,0.0,neutral,,,
12deifc,Cebu,Food place recommendations near University of San Carlos,"suggest the best places around USC TALAMBAN CAMPUS to eat for a student, it should be more of an affordable option",8,0.83,20.0,1680773191.0,2023-04-06 17:26:31,Green-Delay3528,https://www.reddit.com/r/Cebu/comments/12deifc/food_place_recommendations_near_university_of_san/,https://reddit.com/r/Cebu/comments/12deifc/food_place_recommendations_near_university_of_san/,post,"Food place recommendations near University of San Carlos suggest the best places around USC TALAMBAN CAMPUS to eat for a student, it should be more of an affordable option",0.5333333333333333,0.3999999999999999,positive,,,
1cf6g9k,Cebu,USC Tuition fee for BSCS,"Hello, nag try ko search sa website to know the tuition fee for the program but not sure if there's no info for this or libat lang ko. Anyone from USC or naay kaila, naa moy idea pila ang tuition fee for 1st yr college BSCS? TIA",1,1.0,2.0,1714311016.0,2024-04-28 21:30:16,Thick-Gap-497,https://www.reddit.com/r/Cebu/comments/1cf6g9k/usc_tuition_fee_for_bscs/,https://reddit.com/r/Cebu/comments/1cf6g9k/usc_tuition_fee_for_bscs/,post,"USC Tuition fee for BSCS Hello, nag try ko search sa website to know the tuition fee for the program but not sure if there's no info for this or libat lang ko. Anyone from USC or naay kaila, naa moy idea pila ang tuition fee for 1st yr college BSCS? TIA",-0.25,0.8888888888888888,negative,,,
18r54zg,Cebu,University of San Carlos. Masters in chemical Engineer,H. Naa koy plan to take up my masters sa usc. I hope naay maka provide nako sa curriculum since wa jod ko kita sa ilang page or maski asa. Thank youuu daan. Will greatly help me,1,1.0,2.0,1703585872.0,2023-12-26 18:17:52,hyphengineer,https://www.reddit.com/r/Cebu/comments/18r54zg/university_of_san_carlos_masters_in_chemical/,https://reddit.com/r/Cebu/comments/18r54zg/university_of_san_carlos_masters_in_chemical/,post,University of San Carlos. Masters in chemical Engineer H. Naa koy plan to take up my masters sa usc. I hope naay maka provide nako sa curriculum since wa jod ko kita sa ilang page or maski asa. Thank youuu daan. Will greatly help me,0.8,0.75,positive,,,
13g4h4t,Cebu,How to commute from South Bus Terminal to University of San Carlos - Talamban?,Through jeep po or modern jeep unta. Ang nahibaw an pa nako kay naay waiting area dapit sa act ug kilid sa e-mall para sa jeep. I also heard na naay pagkalakwonon ang kani na usc campus so I was wondering sad kung naa ba sad silay transpovehicle sad sa sulod for those students who don't prefer to walk to their respective departments.,3,1.0,4.0,1683944355.0,2023-05-13 10:19:15,Reader_of_a_Reader,https://www.reddit.com/r/Cebu/comments/13g4h4t/how_to_commute_from_south_bus_terminal_to/,https://reddit.com/r/Cebu/comments/13g4h4t/how_to_commute_from_south_bus_terminal_to/,post,How to commute from South Bus Terminal to University of San Carlos - Talamban? Through jeep po or modern jeep unta. Ang nahibaw an pa nako kay naay waiting area dapit sa act ug kilid sa e-mall para sa jeep. I also heard na naay pagkalakwonon ang kani na usc campus so I was wondering sad kung naa ba sad silay transpovehicle sad sa sulod for those students who don't prefer to walk to their respective departments.,-0.26,0.6799999999999999,negative,,,
pxqzdw,Cebu,USC TUITION FEE,Pilay tuition fee sa USC karon?,5,0.86,14.0,1632903813.0,2021-09-29 16:23:33,hooodheeee,https://www.reddit.com/r/Cebu/comments/pxqzdw/usc_tuition_fee/,https://reddit.com/r/Cebu/comments/pxqzdw/usc_tuition_fee/,post,USC TUITION FEE Pilay tuition fee sa USC karon?,0.0,0.0,neutral,,,
lkag7j,Cebu,"The SVD Philippines Southern Province and the University of San Carlos' official joint statement on the rescue of Lumad children and arrest of Lumad teachers and elders at the university's Talamban Campus earlier today, February 15, 2021.",,22,0.96,7.0,1613382629.0,2021-02-15 17:50:29,kwentongskyblue,https://i.redd.it/a63g06utzlh61.jpg,https://reddit.com/r/Cebu/comments/lkag7j/the_svd_philippines_southern_province_and_the/,post,"The SVD Philippines Southern Province and the University of San Carlos' official joint statement on the rescue of Lumad children and arrest of Lumad teachers and elders at the university's Talamban Campus earlier today, February 15, 2021.",-0.0166666666666666,0.1666666666666666,neutral,,,
khbkt0,Cebu,University of San Carlos,Hello po. I am currently grade 12 and I plan to take college in USC sa sy. 2021-2022. Do u guys know when mag staang admission? Thank u hahahah,5,0.86,4.0,1608531198.0,2020-12-21 14:13:18,kiyaruhhh,https://www.reddit.com/r/Cebu/comments/khbkt0/university_of_san_carlos/,https://reddit.com/r/Cebu/comments/khbkt0/university_of_san_carlos/,post,University of San Carlos Hello po. I am currently grade 12 and I plan to take college in USC sa sy. 2021-2022. Do u guys know when mag staang admission? Thank u hahahah,0.0,0.4,neutral,,,
1jvr14u,Cebu,School that offer flexible schedules in Cebu?,"Hi, I want to ask regarding sa nice nga school in cebu where makaya ra muschool and mo work? My first choice is Radtech and second is Nursing nga mo offer ug flexible nga sched ug makaya ra ang time for working unta. WFH akoang job and night shif. I hope matubaggg hehe 😉",0,0.5,3.0,1744265260.0,2025-04-10 14:07:40,Savings_Sky_7747,https://www.reddit.com/r/Cebu/comments/1jvr14u/school_that_offer_flexible_schedules_in_cebu/,https://reddit.com/r/Cebu/comments/1jvr14u/school_that_offer_flexible_schedules_in_cebu/,post,"School that offer flexible schedules in Cebu? Hi, I want to ask regarding sa nice nga school in cebu where makaya ra muschool and mo work? My first choice is Radtech and second is Nursing nga mo offer ug flexible nga sched ug makaya ra ang time for working unta. WFH akoang job and night shif. I hope matubaggg hehe 😉",0.2833333333333333,0.4444444444444444,positive,,,
1jwnbvl,Cebu,TABOAN AND CARBON MARKET,Ano po ang pwedeng sakyan na jeep mula University of San Carlos Museum papuntang Taboan Market or Carbon Market? May oras ba ang open or bagsakan ng goods sa Taboan at Carbon? Thank you,1,1.0,2.0,1744370113.0,2025-04-11 19:15:13,ereeeh-21,https://www.reddit.com/r/Cebu/comments/1jwnbvl/taboan_and_carbon_market/,https://reddit.com/r/Cebu/comments/1jwnbvl/taboan_and_carbon_market/,post,TABOAN AND CARBON MARKET Ano po ang pwedeng sakyan na jeep mula University of San Carlos Museum papuntang Taboan Market or Carbon Market? May oras ba ang open or bagsakan ng goods sa Taboan at Carbon? Thank you,0.0,0.5,neutral,,,
1hw0g2g,Cebu,Is UC Law still working-student friendly?,"Working-student friendly ra ang UC law karon nga panahona? Naa may nag-ingon *oo* pero sauna pa jud to niya basin nagbago na ron. Ganahan unta ko USC, pero murag discouraged man if working ka. Online ra man ako work (8-5), pero ambot if mada gyapon kay intensive kaayo sila to the point nga basin mahutdan kog work-life balance ani. USJR, wala ko idea if nice ang quality of teaching diri. In other words, UC law ra gyud ako option as of the moment. I heard naa pud sila scholarships for laudes, so mao sad ganahan ko. Thoughts?",6,1.0,9.0,1736280070.0,2025-01-08 04:01:10,thoughtalchemyst,https://www.reddit.com/r/Cebu/comments/1hw0g2g/is_uc_law_still_workingstudent_friendly/,https://reddit.com/r/Cebu/comments/1hw0g2g/is_uc_law_still_workingstudent_friendly/,post,"Is UC Law still working-student friendly? Working-student friendly ra ang UC law karon nga panahona? Naa may nag-ingon *oo* pero sauna pa jud to niya basin nagbago na ron. Ganahan unta ko USC, pero murag discouraged man if working ka. Online ra man ako work (8-5), pero ambot if mada gyapon kay intensive kaayo sila to the point nga basin mahutdan kog work-life balance ani. USJR, wala ko idea if nice ang quality of teaching diri. In other words, UC law ra gyud ako option as of the moment. I heard naa pud sila scholarships for laudes, so mao sad ganahan ko. Thoughts?",0.145,0.675,positive,,,
1ips7uh,Cebu,responses needed for our survey!,"MISSING... you! We are 4th-year Psychology students from the University of San Carlos conducting a study on social media engagement, cognitive dissonance, and affective polarization. We're inviting participants to answer a questionnaire that will take only about 20-30 minutes of your time. You can participate if you: Are 18-26 years old Have lived in Cebu City for at least 1 year As a token of appreciation, one lucky respondent will receive ₱250 GCash! If you meet the criteria, kindly access the survey here: [ [ [ Thank you for helping us out!",1,1.0,0.0,1739588761.0,2025-02-15 11:06:01,between320chars,https://www.reddit.com/r/Cebu/comments/1ips7uh/responses_needed_for_our_survey/,https://reddit.com/r/Cebu/comments/1ips7uh/responses_needed_for_our_survey/,post,"responses needed for our survey! MISSING... you! We are 4th-year Psychology students from the University of San Carlos conducting a study on social media engagement, cognitive dissonance, and affective polarization. We're inviting participants to answer a questionnaire that will take only about 20-30 minutes of your time. You can participate if you: Are 18-26 years old Have lived in Cebu City for at least 1 year As a token of appreciation, one lucky respondent will receive ₱250 GCash! If you meet the criteria, kindly access the survey here: [ [ [ Thank you for helping us out!",-0.0421875,0.55625,neutral,,,
1esaxce,Cebu,"Visiting Cebu, interested in the study of Filipino history, philosophy, etc.","I am visiting Cebu for work over August and September. I am interested in connecting with people interested in literature, philosophy, history, that soof thing. Anybody with a passion for intellectual life in the Philippines. How hard is this soof thing to find? I looked around at various universities in Cebu and didn't see much emphasis on the humanities. The University of San Carlos has a philosophy department, but no history department. Can anyone shed any light here? I'd be immensely grateful.",8,0.9,14.0,1723665113.0,2024-08-15 03:51:53,Aggravating_Cat_5653,https://www.reddit.com/r/Cebu/comments/1esaxce/visiting_cebu_interested_in_the_study_of_filipino/,https://reddit.com/r/Cebu/comments/1esaxce/visiting_cebu_interested_in_the_study_of_filipino/,post,"Visiting Cebu, interested in the study of Filipino history, philosophy, etc. I am visiting Cebu for work over August and September. I am interested in connecting with people interested in literature, philosophy, history, that soof thing. Anybody with a passion for intellectual life in the Philippines. How hard is this soof thing to find? I looked around at various universities in Cebu and didn't see much emphasis on the humanities. The University of San Carlos has a philosophy department, but no history department. Can anyone shed any light here? I'd be immensely grateful.",0.1509259259259259,0.537962962962963,positive,,,
1evsvoq,Cebu,Asa maka apply ug Internship / OJT?,"LOOKING FOR OJT/INTERNSHIP OPPORTUNITY Good day! We are 4th year Bachelor of Science in Psychology students from University of San Carlos. As paof our degree requirements, we are looking for a company that offers: 📌Internship/OJT related to Human Resources (HR) 📌need to render 200 hours 📌Offers day shift and onsite work 📌Must be willing to enter a partnership and sign a Memorandum of Agreement (MOA) 📌Willing to provide a certificate of completion 📌With/ without allowance (preferably with) 📌Must be located in Cebu City (preferably near/at IT Park Cebu or Talamban)",2,0.75,3.0,1724040958.0,2024-08-19 12:15:58,ahnaheyram,https://www.reddit.com/r/Cebu/comments/1evsvoq/asa_maka_apply_ug_internship_ojt/,https://reddit.com/r/Cebu/comments/1evsvoq/asa_maka_apply_ug_internship_ojt/,post,"Asa maka apply ug Internship / OJT? LOOKING FOR OJT/INTERNSHIP OPPORTUNITY Good day! We are 4th year Bachelor of Science in Psychology students from University of San Carlos. As paof our degree requirements, we are looking for a company that offers: 📌Internship/OJT related to Human Resources (HR) 📌need to render 200 hours 📌Offers day shift and onsite work 📌Must be willing to enter a partnership and sign a Memorandum of Agreement (MOA) 📌Willing to provide a certificate of completion 📌With/ without allowance (preferably with) 📌Must be located in Cebu City (preferably near/at IT Park Cebu or Talamban)",0.245,0.37,positive,,,
1e50tpd,Cebu,naa ba history ug uspf na eliminating/na irreg na students?,naa ba sila history of failing students pangutana lng ko plano mi enroll this s.y,1,1.0,1.0,1721166272.0,2024-07-17 05:44:32,ConstipatedVegetable,https://www.reddit.com/r/Cebu/comments/1e50tpd/naa_ba_history_ug_uspf_na_eliminatingna_irreg_na/,https://reddit.com/r/Cebu/comments/1e50tpd/naa_ba_history_ug_uspf_na_eliminatingna_irreg_na/,post,naa ba history ug uspf na eliminating/na irreg na students? naa ba sila history of failing students pangutana lng ko plano mi enroll this s.y,0.0,0.0,neutral,,,
1aiaszs,Cebu,"Hello! Any Part-Time Jobs for Students in Cebu City, Mandaue City, and Lapu-Lapu City?","Maayong Adlaw sa tanan! I am student from the University of San Carlos who is currently taking a Thesis as a sole subject for the semester. As such, I have a lot of time in my hands and I prefer to spend that time earning some money just to sustain my-self. Preferably, the Jobs that I want to take has to be within the cities I listed in the title for the sake of convenience. Salamat po!",11,0.92,8.0,1707006736.0,2024-02-04 08:32:16,Kazutrash4,https://www.reddit.com/r/Cebu/comments/1aiaszs/hello_any_parttime_jobs_for_students_in_cebu_city/,https://reddit.com/r/Cebu/comments/1aiaszs/hello_any_parttime_jobs_for_students_in_cebu_city/,post,"Hello! Any Part-Time Jobs for Students in Cebu City, Mandaue City, and Lapu-Lapu City? Maayong Adlaw sa tanan! I am student from the University of San Carlos who is currently taking a Thesis as a sole subject for the semester. As such, I have a lot of time in my hands and I prefer to spend that time earning some money just to sustain my-self. Preferably, the Jobs that I want to take has to be within the cities I listed in the title for the sake of convenience. Salamat po!",-0.0416666666666666,0.3708333333333333,neutral,,,
18ci3js,Cebu,Hello. Schools here in Cebu that offers BSAIS?,Hello? Asa nga schools diri naay BSAIS na gi offer and how much ang tuition? Salamat kaayooo,0,0.33,8.0,1701906997.0,2023-12-07 07:56:37,meowa_weewoweewoo,https://www.reddit.com/r/Cebu/comments/18ci3js/hello_schools_here_in_cebu_that_offers_bsais/,https://reddit.com/r/Cebu/comments/18ci3js/hello_schools_here_in_cebu_that_offers_bsais/,post,Hello. Schools here in Cebu that offers BSAIS? Hello? Asa nga schools diri naay BSAIS na gi offer and how much ang tuition? Salamat kaayooo,0.15,0.1,positive,,,
17c56r2,Cebu,Can't find articles about cebu political history,"Hello, I am from Manila and I am doing research on Cebu City's Political History but I can't seem to find any reliable source anywhere. Do anyone know where to look or do anyone knows a source like an article? I hope this question finds you well",1,0.6,5.0,1697785816.0,2023-10-20 15:10:16,FinnClark445,https://www.reddit.com/r/Cebu/comments/17c56r2/cant_find_articles_about_cebu_political_history/,https://reddit.com/r/Cebu/comments/17c56r2/cant_find_articles_about_cebu_political_history/,post,"Can't find articles about cebu political history Hello, I am from Manila and I am doing research on Cebu City's Political History but I can't seem to find any reliable source anywhere. Do anyone know where to look or do anyone knows a source like an article? I hope this question finds you well",0.0,0.1,neutral,,,
